jk,efccid,srcid,cmpid,num,srcname,cmp,cmpesc,cmplnk,loc,country,zip,city,title,locid,rd,description,keywords
7984ca92d9026b97,87c0791302cc9c78,6faf90bf39c91b9d,e7bc31ec38b174ef,8,Modern Technology Solutions,Modern Technology Solutions,Modern Technology Solutions,/q-Modern-Technology-Solutions-l-los-angeles-jobs.html,El Segundo,US,90245.0,El Segundo,Sr. Program Manager,ba928c474f54bec8,3M6ckAUefkZnPutjdyKl2076gY71_eKuyWKUhwksfqNKbA-yOnjS1WcvKfUjJWU1,"Overview:

Modern Technology Solutions, Inc. (MTSI) is searching for a Sr. Program Manager to join our team. You will lead a diverse technical team providing highest-quality R&D solutions and services to the Department of Defense, across a spectrum of advanced and emerging technologies.




At MTSI, our more than 1,300 co-owners recognize the high demand for specialized professionals within our industry and that you have many options to choose. As an employee owned company were culture matters, we believe that by investing in our people we are investing in our company’s future!

MTSI’s core capabilities are Systems Engineering and Integration, Modeling and Simulation, Test and Evaluation, Acquisition and Program Support, and Mission Assurance services. Our expertise includes ballistic missile defense, air defense, air vehicle survivability, unmanned aircraft, flight test operations, intelligence support, and cyber/space/homeland defense.

For additional company information, please visit: www.mtsi-va.com

Responsibilities:


As a Sr. Program Manager with MTSI you will lead a team of industry partners and technical subject matter experts in delivering engineering, research, development, test, evaluation and acquisition solutions across DoD and IC programs. You will develop and maintain partnerships with MTSI stakeholders and partners.

Qualifications:

15+ years of relevant DoD work experience in systems engineering and acquisition management

10+ years experience leading increasingly complex engineering and R&D programs

History of highest-quality deliverables in a complex delivery model supporting multiple customers and stakeholders

Leadership experience in communicating on complex technical subject matter with DoD and other US Government senior leadership

Strong technical background in one or more advanced capability domains, such as Space Systems, AI/ML, Autonomy, Cybersecurity, Hypersonics, Microelectronics, Networked C3, Space, and 5G technology

Program Management/PMP certification (e.g. PMI, DAWIA, DAU) and strong background in developing/updating PMPs and related program CDRLs

Desired Requirements:

Experience leading technical collaboration with DoD and Service S&T centers, National Laboratories, and FFRDC and UARC organizations

Strong familiarity and relationships across non-DoD and commercial technology providers in key modernization priority areas

Knowledge of SMC and Space Force technology modernization processes

Recent DoD Special Access Programs experience

Education Requirements:

Master’s Degree, preferably in engineering, physics, mathematics, or computer science

Clearance Requirements:

TS/SCI with previous SAP experience.

Please Note: U.S. Citizenship is required for most MTSI positions.

#mtsi","{'experience': 0.022276783819926732, 'subject': 0.01131967989068688, 'background': 0.01131967989068688, 'modernization': 0.01131967989068688, 'complex': 0.011138391909963366, 'acquisition': 0.009257968724731261, 'stakeholders': 0.009041786024910676, 'program': 0.008828773306494017, 'technical': 0.008828773306494017, 'requirements': 0.0077215511112990595, 'overview': 0.007606882587365758, 'modern': 0.007606882587365758, 'inc': 0.007606882587365758, 'searching': 0.007606882587365758, 'join': 0.007606882587365758, 'diverse': 0.007606882587365758, 'providing': 0.007606882587365758, 'department': 0.007606882587365758, 'spectrum': 0.007606882587365758, 'emerging': 0.007606882587365758, 'technologies': 0.007606882587365758, 'coowners': 0.007606882587365758, 'recognize': 0.007606882587365758, 'high': 0.007606882587365758, 'demand': 0.007606882587365758, 'specialized': 0.007606882587365758, 'professionals': 0.007606882587365758, 'within': 0.007606882587365758, 'many': 0.007606882587365758, 'options': 0.007606882587365758, 'choose': 0.007606882587365758, 'employee': 0.007606882587365758, 'owned': 0.007606882587365758, 'culture': 0.007606882587365758, 'matters': 0.007606882587365758, 'believe': 0.007606882587365758, 'people': 0.007606882587365758, 'future': 0.007606882587365758, 'core': 0.007606882587365758, 'capabilities': 0.007606882587365758, 'integration': 0.007606882587365758, 'modeling': 0.007606882587365758, 'simulation': 0.007606882587365758, 'mission': 0.007606882587365758, 'assurance': 0.007606882587365758, 'expertise': 0.007606882587365758, 'includes': 0.007606882587365758, 'ballistic': 0.007606882587365758, 'missile': 0.007606882587365758, 'vehicle': 0.007606882587365758, 'survivability': 0.007606882587365758, 'unmanned': 0.007606882587365758, 'aircraft': 0.007606882587365758, 'flight': 0.007606882587365758, 'operations': 0.007606882587365758, 'intelligence': 0.007606882587365758, 'cyberspacehomeland': 0.007606882587365758, 'additional': 0.007606882587365758, 'information': 0.007606882587365758, 'visit': 0.007606882587365758, 'wwwmtsivacom': 0.007606882587365758, 'responsibilities': 0.007606882587365758, 'experts': 0.007606882587365758, 'delivering': 0.007606882587365758, 'research': 0.007606882587365758, 'development': 0.007606882587365758, 'ic': 0.007606882587365758, 'develop': 0.007606882587365758, 'maintain': 0.007606882587365758, 'partnerships': 0.007606882587365758, 'qualifications': 0.007606882587365758, 'relevant': 0.007606882587365758, 'work': 0.007606882587365758, 'management': 0.007606882587365758, 'increasingly': 0.007606882587365758, 'history': 0.007606882587365758, 'deliverables': 0.007606882587365758, 'delivery': 0.007606882587365758, 'model': 0.007606882587365758, 'supporting': 0.007606882587365758, 'multiple': 0.007606882587365758, 'customers': 0.007606882587365758, 'communicating': 0.007606882587365758, 'government': 0.007606882587365758, 'senior': 0.007606882587365758, 'one': 0.007606882587365758, 'capability': 0.007606882587365758, 'domains': 0.007606882587365758, 'aiml': 0.007606882587365758, 'autonomy': 0.007606882587365758, 'cybersecurity': 0.007606882587365758, 'hypersonics': 0.007606882587365758, 'microelectronics': 0.007606882587365758, 'networked': 0.007606882587365758, 'managementpmp': 0.007606882587365758, 'certification': 0.007606882587365758, 'eg': 0.007606882587365758, 'pmi': 0.007606882587365758, 'dawia': 0.007606882587365758, 'dau': 0.007606882587365758}"
91622ad9fc120b32,50a34c68d3f34f44,166c8b7f35523033,596e92bbfc751c9c,9,Sony Pictures Entertainment Inc.,Sony Pictures Entertainment,Sony Pictures Entertainment,/q-Sony-Pictures-Entertainment-l-los-angeles-jobs.html,Culver City,US,,Culver City,Director,239cc7311b1aaec2,PWfcGNFA7tgIDxGVBcVa2CpOnQ61wW2vs_GcfRlDl3bE6sV57wQU556_d0Wz_qoJ,"ABOUT FUNIMATION

If it’s anime, it’s Funimation.

As the market leader in anime, we proudly deliver incredible fan experiences across television, feature films, events, collectibles, and the Funimation App.

Headquartered in the US and connected by our global network, we’re an anime-obsessed crew of media, tech, gaming and entertainment experts. As one of 400+ team members serving more than 49 countries and 10 languages, you’ll play a key role in a worldwide community where fans and their passion will always have a place to belong.

Funimation is an independently-operated joint venture between US-based Sony Pictures Entertainment, and Japan’s Aniplex, a subsidiary of Sony Music Entertainment (Japan) Inc. Visit 
funimation.com
 and follow us on 
Facebook
, 
Twitter
, and 
Instagram
.

THE ROLE

We are looking for an experienced Director, Data Engineering who is passionate about architecting data platforms and building out a high-performance engineering team to join the Center for Data and Insights (CDI). This position will report to the VP, BI and Analytics and will play a key part in developing Funimation’s data analytics 2.0 platform and data personalization services. Working in an AWS ecosystem, this role will mentor the data engineers and will work with BI and Analytics leads to standardize technologies and processes across data collection, governance, storage, orchestration and compute to ensure consistency and reliability of data and insights. The right person for this role will have a service-oriented view towards the growing data needs of the organization while future-proofing the tech stack in the background.

Responsibilities:

Lead, manage, and inspire data engineering onsite and offshore teams by creating and delivering scalable data products and services to support various marketing, product, business operations and business intelligence use cases.

Project manage data engineers dedicated to the CDI as well as platform data instrumentation engineers in the cross-functional teams.

Develop scalable resource plans for migrating from Funimation Analytics Platform 1.0 to the new architecture with near real time events, machine learning pipelines using our customer data platform (mParticle) and purpose build pipelines and DBs to activate systems of intelligence.

Work closely with product managers to make application data available for product features for platform personalizations.

Uphold, introduce, and refine data quality standards, KPI certification methods, and engineering best practices.

Challenge existing data structures and compute processes.

Constantly strive to improve engineering workflows and efficiency, and heavily utilize automation whenever applicable.

Optimize data pipelines for performance, reliability, and scalability.

Partner with DevSecOps to optimize cloud infrastructure performance and scalability.

Roll up your sleeves and be directly involved in solving challenging technical problems.

Manage business-critical systems, set and facilitate departmental goals and contribute to core product strategy through data and software architecture excellence

Mentor, hire and develop high-performing full-stack data and software engineers.

Deliver projects on time and within budget.

Requirements:

8+ years of experience in data engineering and/ or software development.

3+ years managing data engineering and analytics teams.

Experience with and understanding of event data collection tools like Snowplow, Segment, Google Tag Manager, Tealium, and mParticle, etc.

Full lifecycle experience implementing compute and orchestration tools like Databricks, Airflow, Talend etc.

Experience with streaming OLAP engines like Druid, ClickHouse, etc.

Experience with AWS services like EMR Spark, Redshift, Kinesis, Lambda, Glue, Athena, etc.

Working knowledge of BI tools such as Tableau, Looker.

Experience building multi-touch attribution platforms using integrations with walled gardens, and digital platforms.

Experience building AI/ML personalization products.

Experience with real-time data systems.

Experience with Customer Data Platforms (CDPs) and Data Management Platforms (DMPs).

Experience with HIPAA, PCI, or other high-security environments.

Experience working with large data sets (Terabytes of data/ billions of records).

Ability to work effectively and positively with others: You have excellent interpersonal skills. You’re a good listener. You place the success of the company ahead of any particular idea.

Proven ability to work across a matrixed organization

Highly articulate and an excellent communicator, with strong influencing skills and the ability to communicate well with peers and senior executives, locally and in different regions

BS in Computer Science, Information Systems, or a related field.

Must have legal right to work in the U.S.

Funimation offers competitive compensation along with a comprehensive benefits package to include health, dental, vision, life, short & long-term disability, 401(k) with a generous company match, ongoing employee development.
Sony Pictures Entertainment is an equal opportunity employer. We evaluate qualified applicants without regard to race, color, religion, sex, national origin, disability, veteran status, age, sexual orientation, gender identity, or other protected characteristics.","{'experience': 0.010936617347165492, 'work': 0.005326406423392433, 'market': 0.005143451615933945, 'leader': 0.005143451615933945, 'proudly': 0.005143451615933945, 'incredible': 0.005143451615933945, 'fan': 0.005143451615933945, 'experiences': 0.005143451615933945, 'television': 0.005143451615933945, 'feature': 0.005143451615933945, 'films': 0.005143451615933945, 'collectibles': 0.005143451615933945, 'app': 0.005143451615933945, 'headquartered': 0.005143451615933945, 'connected': 0.005143451615933945, 'global': 0.005143451615933945, 'network': 0.005143451615933945, 'animeobsessed': 0.005143451615933945, 'crew': 0.005143451615933945, 'media': 0.005143451615933945, 'gaming': 0.005143451615933945, 'experts': 0.005143451615933945, 'one': 0.005143451615933945, 'members': 0.005143451615933945, 'serving': 0.005143451615933945, 'countries': 0.005143451615933945, 'languages': 0.005143451615933945, 'worldwide': 0.005143451615933945, 'community': 0.005143451615933945, 'fans': 0.005143451615933945, 'passion': 0.005143451615933945, 'always': 0.005143451615933945, 'belong': 0.005143451615933945, 'independentlyoperated': 0.005143451615933945, 'joint': 0.005143451615933945, 'venture': 0.005143451615933945, 'usbased': 0.005143451615933945, 'aniplex': 0.005143451615933945, 'subsidiary': 0.005143451615933945, 'music': 0.005143451615933945, 'japan': 0.005143451615933945, 'inc': 0.005143451615933945, 'visit': 0.005143451615933945, 'funimationcom': 0.005143451615933945, 'follow': 0.005143451615933945, 'facebook': 0.005143451615933945, 'twitter': 0.005143451615933945, 'instagram': 0.005143451615933945, 'looking': 0.005143451615933945, 'experienced': 0.005143451615933945, 'director': 0.005143451615933945, 'passionate': 0.005143451615933945, 'architecting': 0.005143451615933945, 'highperformance': 0.005143451615933945, 'join': 0.005143451615933945, 'center': 0.005143451615933945, 'position': 0.005143451615933945, 'report': 0.005143451615933945, 'vp': 0.005143451615933945, 'part': 0.005143451615933945, 'developing': 0.005143451615933945, 'ecosystem': 0.005143451615933945, 'leads': 0.005143451615933945, 'standardize': 0.005143451615933945, 'technologies': 0.005143451615933945, 'governance': 0.005143451615933945, 'storage': 0.005143451615933945, 'ensure': 0.005143451615933945, 'consistency': 0.005143451615933945, 'person': 0.005143451615933945, 'serviceoriented': 0.005143451615933945, 'view': 0.005143451615933945, 'towards': 0.005143451615933945, 'growing': 0.005143451615933945, 'needs': 0.005143451615933945, 'futureproofing': 0.005143451615933945, 'stack': 0.005143451615933945, 'background': 0.005143451615933945, 'responsibilities': 0.005143451615933945, 'lead': 0.005143451615933945, 'inspire': 0.005143451615933945, 'onsite': 0.005143451615933945, 'offshore': 0.005143451615933945, 'creating': 0.005143451615933945, 'delivering': 0.005143451615933945, 'support': 0.005143451615933945, 'various': 0.005143451615933945, 'marketing': 0.005143451615933945, 'operations': 0.005143451615933945, 'use': 0.005143451615933945, 'cases': 0.005143451615933945, 'project': 0.005143451615933945, 'dedicated': 0.005143451615933945, 'instrumentation': 0.005143451615933945, 'crossfunctional': 0.005143451615933945, 'resource': 0.005143451615933945, 'plans': 0.005143451615933945, 'migrating': 0.005143451615933945, 'new': 0.005143451615933945, 'near': 0.005143451615933945}"
