jk,efccid,srcid,cmpid,num,srcname,cmp,cmpesc,cmplnk,loc,country,zip,city,title,locid,rd,description,keywords
1e24db1874d9bc07,c0732f238b249c8a,6b92e37c06eebbb5,fd474e19b2fbd2c9,4,Epirus,Epirus,Epirus,/q-Epirus-l-los-angeles-jobs.html,Hawthorne,US,,Hawthorne,Director of Machine Learning,61fd61c2737e4b7a,twcb2ZEJnz8JwcbwiR9wTVPs4qETAbDlhThHjxgP1-GQ5ckdDWiKs7HJbHG2QBMV,"About Epirus



Epirus is the creator of a revolutionary electromagnetic pulse (EMP) technology designed for protecting the world's skies and airspaces from Unmanned Airborne Vehicles (a.k.a ""drones""). Among counter-drone solutions, our technology is unique in its capability to disable entire swarms of drones quickly and effectively. The core innovation behind this marvel is Epirus's SmartPower(TM), an intelligent power system that optimizes power-efficiency and dramatically reduces size. At Epirus, we're on a journey to push the boundaries of what's possible for the future of power electronics.



About the Opportunity



ÂThe Director of Machine Learning will lead Epirus in spearheading new innovative solutions and enhancements to existing and new products by applying machine learning and leveraging data across all aspects of the business. This role is visible in customer engagement, and this leader must be able to translate customer needs to Epirus' technical teams as the company develops customer-specific, enterprise-grade solutions and services.



The Director of Machine Learning will lead Epirus' modeling and algorithm R&D, tying technology to strategic business goals, and leading the company to new heights as it delivers the market's first and best Software Defined EMP and the world's most powerful energy source to date. He/she will define Epirus' data science roadmap and will be responsible for the innovation and development of Epirus' machine learning capabilities.



Equally important to technical vision, the Director of Machine Learning must be able to recruit, retain and motivate a fast-growing, high output team of passionate data scientists and ML engineers. He/she will be an inspirational leader to the data team with passion and influence that will inspire the company. The Director of Machine Learning will be a strong collaborator and able to effectively partner with other teams, executives and external partners to ensure Epirus' growth and market success.



Responsibilities




Establish the company's technical vision and lead aspects of model development


This leader will help scope prototypes, ensure product-market fit with customers, and (when appropriate) manage the pass-off to Product and Engineering to integrate the prototypes into its core offerings


Lead and foster mentorship and healthy team camaraderie among engineers, data scientists and product talent


Partner with product and leadership on crafting the company's product roadmap


Develop a recruiting strategy that will attract extraordinary data, ML and AI talent from a wide range of diverse backgrounds


Partner with other members of the leadership team to improve the level of innovation, efficiency and effectiveness through the use of technology


Lead the Modeling and Algorithm organization and ensure the business has transparency into the data roadmap and has access to data and important dashboards necessary for company-wide accountability and continuous improvement


Support and be an advocate for the company's culture, mission and values


Stay current on leading edge technology so the organization remains at the forefront of industry innovation




Qualifications




Strong knowledge in the design and performance of Machine Learning topologies and optimization theory


Ideally PhD or equivalent Science experience


A proven track record of leadership, including knowing when to be empathetic; how to communicate across teams and set and articulate a vision; and the ability to actively listen and incorporate new ideas


Has five+ years experience leading teams in the design of machine learning models requiring solutions using embedded processors or in RTL


Ability to architect complex systems and data infrastructures


Hands on technically â€“ can code when necessary but also think strategically about the product roadmap and technical decisions


Product sensibility; has worked closely with product management and design


Has a perspective on and specific experience implementing engineering process and best cares deeply about and enjoys respectful cultures that value great ideas from all people at all levels of the organization


Action orientated with the ability to influence others and implement change and standardized processes


Attention to detail with good business judgment and exceptional maturity, diplomacy and communication skills


Direct and clear communicator practices around scoping, planning, dependency management, stakeholder involvement, delivery, etc.


US Citizen (future security clearance may be required)





At Epirus, we strive to be fast, efficient, and limitless in our approach. This agility, combined with a culture of innovation in systems development, allows us to move quickly without losing the decades of lessons learned.



We have developed technologies that leverage new breakthroughs in sensors and high-power microwaves, combined with computer vision and advanced software control. Our first broad-market application is a comprehensive defense system to defeat offensive drones at scale.","{'organization': 0.008569127232197125, 'experience': 0.006898254533949196, 'quickly': 0.004598836355966131, 'creator': 0.003808500992087612, 'revolutionary': 0.003808500992087612, 'electromagnetic': 0.003808500992087612, 'pulse': 0.003808500992087612, 'designed': 0.003808500992087612, 'protecting': 0.003808500992087612, 'skies': 0.003808500992087612, 'airspaces': 0.003808500992087612, 'unmanned': 0.003808500992087612, 'airborne': 0.003808500992087612, 'vehicles': 0.003808500992087612, 'aka': 0.003808500992087612, 'counterdrone': 0.003808500992087612, 'unique': 0.003808500992087612, 'capability': 0.003808500992087612, 'disable': 0.003808500992087612, 'entire': 0.003808500992087612, 'swarms': 0.003808500992087612, 'behind': 0.003808500992087612, 'marvel': 0.003808500992087612, 'epiruss': 0.003808500992087612, 'smartpowertm': 0.003808500992087612, 'intelligent': 0.003808500992087612, 'optimizes': 0.003808500992087612, 'powerefficiency': 0.003808500992087612, 'dramatically': 0.003808500992087612, 'reduces': 0.003808500992087612, 'size': 0.003808500992087612, 'journey': 0.003808500992087612, 'push': 0.003808500992087612, 'boundaries': 0.003808500992087612, 'whats': 0.003808500992087612, 'possible': 0.003808500992087612, 'electronics': 0.003808500992087612, 'opportunity': 0.003808500992087612, 'âthe': 0.003808500992087612, 'spearheading': 0.003808500992087612, 'innovative': 0.003808500992087612, 'enhancements': 0.003808500992087612, 'existing': 0.003808500992087612, 'products': 0.003808500992087612, 'applying': 0.003808500992087612, 'leveraging': 0.003808500992087612, 'role': 0.003808500992087612, 'visible': 0.003808500992087612, 'engagement': 0.003808500992087612, 'translate': 0.003808500992087612, 'needs': 0.003808500992087612, 'develops': 0.003808500992087612, 'customerspecific': 0.003808500992087612, 'enterprisegrade': 0.003808500992087612, 'services': 0.003808500992087612, 'rd': 0.003808500992087612, 'tying': 0.003808500992087612, 'strategic': 0.003808500992087612, 'goals': 0.003808500992087612, 'heights': 0.003808500992087612, 'delivers': 0.003808500992087612, 'markets': 0.003808500992087612, 'defined': 0.003808500992087612, 'powerful': 0.003808500992087612, 'energy': 0.003808500992087612, 'source': 0.003808500992087612, 'date': 0.003808500992087612, 'define': 0.003808500992087612, 'responsible': 0.003808500992087612, 'capabilities': 0.003808500992087612, 'equally': 0.003808500992087612, 'recruit': 0.003808500992087612, 'retain': 0.003808500992087612, 'motivate': 0.003808500992087612, 'fastgrowing': 0.003808500992087612, 'high': 0.003808500992087612, 'output': 0.003808500992087612, 'passionate': 0.003808500992087612, 'inspirational': 0.003808500992087612, 'passion': 0.003808500992087612, 'inspire': 0.003808500992087612, 'collaborator': 0.003808500992087612, 'executives': 0.003808500992087612, 'external': 0.003808500992087612, 'partners': 0.003808500992087612, 'growth': 0.003808500992087612, 'market': 0.003808500992087612, 'success': 0.003808500992087612, 'responsibilities': 0.003808500992087612, 'establish': 0.003808500992087612, 'model': 0.003808500992087612, 'help': 0.003808500992087612, 'scope': 0.003808500992087612, 'productmarket': 0.003808500992087612, 'fit': 0.003808500992087612, 'customers': 0.003808500992087612, 'appropriate': 0.003808500992087612, 'manage': 0.003808500992087612, 'passoff': 0.003808500992087612, 'integrate': 0.003808500992087612}"
c0fb5b16e8cb7c12,8aa00ea0d3a4415a,2d3e08667f6efa3f,115307c5b7ae393c,5,Indeed,Zest AI,Zest AI,/q-Zest-AI-l-los-angeles-jobs.html,Burbank,US,,Burbank,Senior Data Scientist,e4def748a1a55a53,wQqIkzc2s6nicwjvnOnMaSBwb8R4TUsc5HSm5ps1F5JfzCp2kgBRgLA-pHxERbd4,"Data Scientists at Zest AI use the power of machine learning to build models and optimize software tools that our customers depend on in order to meet the financial needs of people around the world. By leveraging a combination of machine learning and vast amounts of data points, we seek to challenge the traditional credit scoring model, while expanding our proprietary AI-explainability technology across the fintech industry.
In this role you will: 
Translate unstructured business problems into well-defined machine learning projects
Collaborate with a cross-functional team of Engineers, Product Managers, and Business Analysts to identify and manage high leverage opportunities for modeling work
Design and implement highly generalizable models for predicting various outcomes. Incorporate and develop learnings back into the product for continuous improvement opportunities
Build demos, guidance documentation, and assist with training to help others become more proficient
Take responsibility for modeling implementation in real world settings. This may include creating experiments and developing prototypes, with the goal of returning practical value to our customers
We are looking for: 
MS or PhD in a quantitative field (Computer Science, Engineering, Physics, etc.) with hands-on experience of 3 years or more – experience in financial services is a plus!
Strong fundamentals in programming, statistics, mathematics, and ML algorithms (neural networks, tree-based methods, optimizers, super/unsupervised learning, feature engineering, etc.)
Expert experience designing, developing, and implementing machine learning models/algorithms. Familiar with implementing and developing/extending ML/AI frameworks (TensorFlow, XGBoost, Scikit-learn, etc.)
Good development awareness regarding memory, disk I/O, and CPU/GPU management. Experience with modular/modern software design practices strongly preferred, in addition to experience with Python
Passionate about ML/AI and how it can improve on the world
Perks and benefits: 
Robust healthcare plans, matching 401K and unlimited vacation time
Weekly companywide “all hands” meetings
Virtual weekly happy hours, sometimes casual and other times with a focus around topics like racial discrimination and LGBTQ+ history
Employee care packages to make WFH more enjoyable
About Zest AI: 
Zest AI has been perfecting AI for consumer lending decisions since 2009. Our Model Management System helps lenders make better decisions and better loans—increasing revenue, reducing risk, and automating compliance. Our mission is to make fair and transparent credit available to everyone and our software creates some of the most inclusive risk models in the industry. Using Zest-built machine learning software, financial institutions can dramatically expand credit access to deserving people with no added risk. Learn more at Zest.ai and connect with us on Twitter @Zest_AI or our Insights blog.
Zest is committed to diversity, equity, and inclusion and encourages professionals from underrepresented groups in technology and financial services to apply.
Please review our CCPA Policy with regard to applicant and employee personal information here.
Job Type: Full-time","{'zest': 0.01625178656896195, 'experience': 0.010708181506132104, 'zestai': 0.008125893284480976, 'scientists': 0.006554130970286088, 'use': 0.006554130970286088, 'power': 0.006554130970286088, 'optimize': 0.006554130970286088, 'tools': 0.006554130970286088, 'depend': 0.006554130970286088, 'order': 0.006554130970286088, 'meet': 0.006554130970286088, 'needs': 0.006554130970286088, 'leveraging': 0.006554130970286088, 'combination': 0.006554130970286088, 'vast': 0.006554130970286088, 'amounts': 0.006554130970286088, 'points': 0.006554130970286088, 'seek': 0.006554130970286088, 'challenge': 0.006554130970286088, 'traditional': 0.006554130970286088, 'scoring': 0.006554130970286088, 'expanding': 0.006554130970286088, 'proprietary': 0.006554130970286088, 'aiexplainability': 0.006554130970286088, 'across': 0.006554130970286088, 'fintech': 0.006554130970286088, 'role': 0.006554130970286088, 'translate': 0.006554130970286088, 'unstructured': 0.006554130970286088, 'problems': 0.006554130970286088, 'welldefined': 0.006554130970286088, 'projects': 0.006554130970286088, 'collaborate': 0.006554130970286088, 'crossfunctional': 0.006554130970286088, 'team': 0.006554130970286088, 'engineers': 0.006554130970286088, 'managers': 0.006554130970286088, 'analysts': 0.006554130970286088, 'identify': 0.006554130970286088, 'manage': 0.006554130970286088, 'high': 0.006554130970286088, 'leverage': 0.006554130970286088, 'work': 0.006554130970286088, 'implement': 0.006554130970286088, 'highly': 0.006554130970286088, 'generalizable': 0.006554130970286088, 'predicting': 0.006554130970286088, 'various': 0.006554130970286088, 'outcomes': 0.006554130970286088, 'incorporate': 0.006554130970286088, 'develop': 0.006554130970286088, 'learnings': 0.006554130970286088, 'back': 0.006554130970286088, 'continuous': 0.006554130970286088, 'improvement': 0.006554130970286088, 'demos': 0.006554130970286088, 'guidance': 0.006554130970286088, 'documentation': 0.006554130970286088, 'assist': 0.006554130970286088, 'training': 0.006554130970286088, 'help': 0.006554130970286088, 'others': 0.006554130970286088, 'become': 0.006554130970286088, 'proficient': 0.006554130970286088, 'take': 0.006554130970286088, 'responsibility': 0.006554130970286088, 'implementation': 0.006554130970286088, 'real': 0.006554130970286088, 'settings': 0.006554130970286088, 'may': 0.006554130970286088, 'include': 0.006554130970286088, 'creating': 0.006554130970286088, 'experiments': 0.006554130970286088, 'prototypes': 0.006554130970286088, 'goal': 0.006554130970286088, 'returning': 0.006554130970286088, 'practical': 0.006554130970286088, 'value': 0.006554130970286088, 'looking': 0.006554130970286088, 'ms': 0.006554130970286088, 'phd': 0.006554130970286088, 'quantitative': 0.006554130970286088, 'field': 0.006554130970286088, 'computer': 0.006554130970286088, 'science': 0.006554130970286088, 'physics': 0.006554130970286088, 'handson': 0.006554130970286088, 'years': 0.006554130970286088, 'plus': 0.006554130970286088, 'strong': 0.006554130970286088, 'fundamentals': 0.006554130970286088, 'programming': 0.006554130970286088, 'statistics': 0.006554130970286088, 'mathematics': 0.006554130970286088, 'ml': 0.006554130970286088, 'algorithms': 0.006554130970286088, 'neural': 0.006554130970286088, 'networks': 0.006554130970286088, 'treebased': 0.006554130970286088, 'methods': 0.006554130970286088}"
