jk,efccid,srcid,cmpid,num,srcname,cmp,cmpesc,cmplnk,loc,country,zip,city,title,locid,rd,description,keywords
55c3273708339a47,f7808c5a9a603597,7f25b330f90f0627,870fe746e6c64ba6,0,Indeed,Hireguide,Hireguide,/q-Hireguide-l-los-angeles-jobs.html,Santa Monica,US,,Santa Monica,Head of Product,efb633cb66a2b8a6,E4fhWX_aAFqF37QMCtQEyoXu0O3q_u7jR-ad0LIkJdk,"Headline: 
 We’re looking for a highly skilled Head of Product with an entrepreneurial spirit to join the founding team of a hyper-growth, well funded startup that is deepening human understanding through fairer, more connected interviews.
*
You will be joining two former LinkedIn execs with a lifetime of experience in hiring, building successful businesses, software engineering, advanced AI and social impact.
*
*
Context: 
Every year companies are forced to reinvent interviews for the same ~100 professional roles, 500M times. Interviewing is slow, biased, lacks prediction, and candidates rarely get what they deserve.
Hireguide is a platform that lets hiring teams interview like experts for any role in minutes. We’re sharing what works from thousands of real questions, recordings and ratings, all analyzed by advanced natural language processing. For companies Hireguide makes interview preparation 20X faster, decisions twice as predictive and top candidates more likely to say yes. For candidates Hireguide delivers clearer interview instructions, a voice in the process, and actionable feedback. For society, Hireguide is a BCorp democratizing access to fairer interviewing.
The experience we offer: 
Develop skills on the cutting edge of AI tech, applying NLP / Conversational AI to Talent conversations
Work with industry “A-Players” - Eg CTO (PhD in AI) built the ML infrastructure for LinkedIn
Create a product, culture and business from the ground-up with true ownership
Establish true north customer value metrics and manage accelerating customer success
Learn to differentiate product through human centric design and ease of use
Hire and manage a large Product and Design team within a year
Mentoring by industry experts (including human centric design training)
Drive business hyper-growth, including early stage accountability and scaling
Solve a meaningful social problem by democratizing access to fairer more effective interviewing
The experience you offer: 
High EQ including a growth mindset, sharing credit, intense preparation, leading without authority
Experience capturing and prioritizing customer product requirements using multiple methods
Technical skills (eg a Computer Science background)
8-10 years experience building web based software from ideation, launch, to refinement (ideally: within AI / NLP, in HR, SaaS, B2B, 8+ years experience, managed others)
Balanced skill between 1) strategy and execution, 2) creativity and critical thinking, 3) customer and engineering empathy
Track record of accountability and results throughout lifetime (history of success)
Top seven skills under evaluation (ranked): 
1) Structured Problem Solving, 2) Product Management, 3) UX Design, 4) Coding Knowledge, 5) Agile 6) Managing Self 7) Managing Others
Total reward transparency: 
This role can be based anywhere in the US (preferred), Canada (preferred), UK/EU or Australia. Foundational hires are paid annual cash between $150-200k USD to maintain a comfortable lifestyle, but meaningful founding-team equity is the heart of the compensation upside. Founding team equity is expected to be worth multi-millions within a few years, potentially a lot more when we achieve our vision. We also offer competitive benefits, remote work, international offsites, four weeks vacation. Required to travel to California (Bay Area and/or Santa Monica) multiple times per year, health safety permitting.
*
Job Type: Full-time
Pay: $150,000.00 - $200,000.00 per year
Work Location:
Multiple locations
Work Remotely:
Yes","{'experience': 0.01635161863895653, 'democratizing': 0.006636857370862269, 'headline': 0.005583608662066412, 'looking': 0.005583608662066412, 'highly': 0.005583608662066412, 'skilled': 0.005583608662066412, 'head': 0.005583608662066412, 'entrepreneurial': 0.005583608662066412, 'spirit': 0.005583608662066412, 'join': 0.005583608662066412, 'well': 0.005583608662066412, 'funded': 0.005583608662066412, 'startup': 0.005583608662066412, 'deepening': 0.005583608662066412, 'understanding': 0.005583608662066412, 'connected': 0.005583608662066412, 'joining': 0.005583608662066412, 'two': 0.005583608662066412, 'former': 0.005583608662066412, 'execs': 0.005583608662066412, 'successful': 0.005583608662066412, 'businesses': 0.005583608662066412, 'impact': 0.005583608662066412, 'context': 0.005583608662066412, 'every': 0.005583608662066412, 'forced': 0.005583608662066412, 'reinvent': 0.005583608662066412, 'professional': 0.005583608662066412, 'roles': 0.005583608662066412, 'slow': 0.005583608662066412, 'biased': 0.005583608662066412, 'lacks': 0.005583608662066412, 'prediction': 0.005583608662066412, 'rarely': 0.005583608662066412, 'get': 0.005583608662066412, 'deserve': 0.005583608662066412, 'platform': 0.005583608662066412, 'lets': 0.005583608662066412, 'teams': 0.005583608662066412, 'like': 0.005583608662066412, 'minutes': 0.005583608662066412, 'works': 0.005583608662066412, 'thousands': 0.005583608662066412, 'real': 0.005583608662066412, 'questions': 0.005583608662066412, 'recordings': 0.005583608662066412, 'ratings': 0.005583608662066412, 'analyzed': 0.005583608662066412, 'natural': 0.005583608662066412, 'language': 0.005583608662066412, 'processing': 0.005583608662066412, 'makes': 0.005583608662066412, 'faster': 0.005583608662066412, 'decisions': 0.005583608662066412, 'twice': 0.005583608662066412, 'predictive': 0.005583608662066412, 'likely': 0.005583608662066412, 'say': 0.005583608662066412, 'delivers': 0.005583608662066412, 'clearer': 0.005583608662066412, 'instructions': 0.005583608662066412, 'voice': 0.005583608662066412, 'process': 0.005583608662066412, 'actionable': 0.005583608662066412, 'feedback': 0.005583608662066412, 'society': 0.005583608662066412, 'bcorp': 0.005583608662066412, 'develop': 0.005583608662066412, 'cutting': 0.005583608662066412, 'edge': 0.005583608662066412, 'tech': 0.005583608662066412, 'applying': 0.005583608662066412, 'conversational': 0.005583608662066412, 'talent': 0.005583608662066412, 'conversations': 0.005583608662066412, 'cto': 0.005583608662066412, 'phd': 0.005583608662066412, 'built': 0.005583608662066412, 'ml': 0.005583608662066412, 'infrastructure': 0.005583608662066412, 'create': 0.005583608662066412, 'culture': 0.005583608662066412, 'groundup': 0.005583608662066412, 'ownership': 0.005583608662066412, 'establish': 0.005583608662066412, 'north': 0.005583608662066412, 'value': 0.005583608662066412, 'metrics': 0.005583608662066412, 'accelerating': 0.005583608662066412, 'learn': 0.005583608662066412, 'differentiate': 0.005583608662066412, 'ease': 0.005583608662066412, 'use': 0.005583608662066412, 'hire': 0.005583608662066412, 'large': 0.005583608662066412, 'mentoring': 0.005583608662066412, 'training': 0.005583608662066412, 'drive': 0.005583608662066412, 'early': 0.005583608662066412, 'stage': 0.005583608662066412}"
9b2dbc39974c3b8a,104ed0ead9bebd2a,34a7086e9a78de3b,999d3c05cd82162f,1,Indeed,Checkmate Partners,Checkmate Partners,/q-Checkmate-Partners-l-los-angeles-jobs.html,Los Angeles,US,,Los Angeles,Computer Vision \/ ML Engineering Lead,d05a4fe50c5af0a8,E4fhWX_aAFqF37QMCtQEyoXu0O3q_u7jR-ad0LIkJdk,"*Location: Will be based out of Bay Area or San Diego Metropolitan Offices*
About Us: 
Be part of an exciting, well-funded startup changing the world of retail. Our mission is to revolutionize customer experience in retail through precise identification of inventory in the stores and distribution centers, completely transforming the in-store experience for employees and customers alike. Our proprietary hardware and software platform combines RFID, Computer Vision and AI to provide hyper-precise, real-time location of every product and person in physical stores. This unprecedented capability enables retailers to automate in-store inventory management, analytics, and checkout...and this is just the beginning of what we hope to accomplish together.
About The Job: 
The Engineering Manager for the CV/ML team will lead a team of CV/ML engineers to develop a solution to enable Product-People association using Computer Vision, RFID and Machine Learning models. The Manager will collaborate with product teams and leadership team to set the team’s roadmap, manage and prioritize feature development.
Responsibilities: 
Deliver robust, well-tested, and fully documented CV modules to serve the use cases.
Learn and implement state-of-the-art deep learning algorithms to support people and product association.
Collaborate with system architects, designers, and engineers to support the development of robust machine learning systems.
Continuously improve the efficiency, robustness, and cost of existing modules.
Assess and recommend technology choices and directions in consideration of cost-benefit trade-offs.
Work with Product Management to prioritize feature development
Build roadmaps, engineering plans, and schedule estimates
Perform code reviews and ensuring proper design and delivery
Promote best practices and establishing team processes
Identify infrastructure and architectural investment needs
Hire, develop, and lead an inclusive, engaged, and high performing team
Qualifications: 
3+ years of experience managing in one or more CV areas as object detection, pattern recognition, and image classification.
5+ years of relevant experience as a CV Engineer, Data Scientist, Machine Learning Engineer, or related role
Experience with common languages (e.g., Python, SQL) and tools (e.g., TensorFlow, PyTorch, distributed training / inference with Spark) in the ML toolkit
Experience with developing popular open-source projects
Experience in designing and building highly scalable, distributed ML models
Experience in deploying machine learning algorithms in resource-restricted environments such as embedded systems is preferred
Strong ability to prioritize among competing priorities
Excellent written and verbal technical communication skills
MS / PhD in engineering or quantitative discipline (e.g., Statistics, Mathematics, Computer Science, etc.)
Preferred: 
You have prior experience working at a startup
*Location: Will be based out of Bay Area or San Diego Metropolitan Offices*
Job Type: Full-time
Pay: $150,000.00 - $220,000.00 per hour
Benefits:
401(k)
Health insurance
Application Question(s):
Please Provide Your LinkedIn Profile
Please Provide Your Email Address
Are you able to reliable commute to this location for work?
Are you willing to relocate for this role?
Education:
Bachelor's (Preferred)
Experience:
MATLAB: 1 year (Preferred)
Computer vision: 3 years (Required)
Python: 3 years (Required)
TensorFlow: 3 years (Preferred)
Machine learning: 3 years (Required)
Work Location:
Multiple locations","{'experience': 0.017477348270284732, 'required': 0.013188846987398535, 'prioritize': 0.008792564658265691, 'work': 0.007377277863460978, 'job': 0.007078124454848506, 'us': 0.0058617097721771275, 'part': 0.0058617097721771275, 'exciting': 0.0058617097721771275, 'wellfunded': 0.0058617097721771275, 'changing': 0.0058617097721771275, 'world': 0.0058617097721771275, 'mission': 0.0058617097721771275, 'revolutionize': 0.0058617097721771275, 'customer': 0.0058617097721771275, 'precise': 0.0058617097721771275, 'identification': 0.0058617097721771275, 'distribution': 0.0058617097721771275, 'centers': 0.0058617097721771275, 'completely': 0.0058617097721771275, 'transforming': 0.0058617097721771275, 'employees': 0.0058617097721771275, 'customers': 0.0058617097721771275, 'alike': 0.0058617097721771275, 'proprietary': 0.0058617097721771275, 'hardware': 0.0058617097721771275, 'software': 0.0058617097721771275, 'platform': 0.0058617097721771275, 'combines': 0.0058617097721771275, 'ai': 0.0058617097721771275, 'hyperprecise': 0.0058617097721771275, 'realtime': 0.0058617097721771275, 'every': 0.0058617097721771275, 'person': 0.0058617097721771275, 'physical': 0.0058617097721771275, 'unprecedented': 0.0058617097721771275, 'capability': 0.0058617097721771275, 'enables': 0.0058617097721771275, 'retailers': 0.0058617097721771275, 'automate': 0.0058617097721771275, 'analytics': 0.0058617097721771275, 'checkoutand': 0.0058617097721771275, 'beginning': 0.0058617097721771275, 'hope': 0.0058617097721771275, 'accomplish': 0.0058617097721771275, 'together': 0.0058617097721771275, 'solution': 0.0058617097721771275, 'enable': 0.0058617097721771275, 'productpeople': 0.0058617097721771275, 'using': 0.0058617097721771275, 'teams': 0.0058617097721771275, 'leadership': 0.0058617097721771275, 'set': 0.0058617097721771275, 'roadmap': 0.0058617097721771275, 'manage': 0.0058617097721771275, 'responsibilities': 0.0058617097721771275, 'deliver': 0.0058617097721771275, 'welltested': 0.0058617097721771275, 'fully': 0.0058617097721771275, 'documented': 0.0058617097721771275, 'serve': 0.0058617097721771275, 'use': 0.0058617097721771275, 'cases': 0.0058617097721771275, 'learn': 0.0058617097721771275, 'implement': 0.0058617097721771275, 'stateoftheart': 0.0058617097721771275, 'deep': 0.0058617097721771275, 'people': 0.0058617097721771275, 'system': 0.0058617097721771275, 'architects': 0.0058617097721771275, 'designers': 0.0058617097721771275, 'continuously': 0.0058617097721771275, 'improve': 0.0058617097721771275, 'efficiency': 0.0058617097721771275, 'robustness': 0.0058617097721771275, 'cost': 0.0058617097721771275, 'existing': 0.0058617097721771275, 'assess': 0.0058617097721771275, 'recommend': 0.0058617097721771275, 'technology': 0.0058617097721771275, 'choices': 0.0058617097721771275, 'directions': 0.0058617097721771275, 'consideration': 0.0058617097721771275, 'costbenefit': 0.0058617097721771275, 'tradeoffs': 0.0058617097721771275, 'build': 0.0058617097721771275, 'roadmaps': 0.0058617097721771275, 'plans': 0.0058617097721771275, 'schedule': 0.0058617097721771275, 'estimates': 0.0058617097721771275, 'perform': 0.0058617097721771275, 'code': 0.0058617097721771275, 'reviews': 0.0058617097721771275, 'ensuring': 0.0058617097721771275, 'proper': 0.0058617097721771275, 'design': 0.0058617097721771275, 'delivery': 0.0058617097721771275, 'promote': 0.0058617097721771275, 'best': 0.0058617097721771275, 'practices': 0.0058617097721771275, 'establishing': 0.0058617097721771275}"
