jk,efccid,srcid,cmpid,num,srcname,cmp,cmpesc,cmplnk,loc,country,zip,city,title,locid,rd,description,keywords
61fce2398a8b0792,035c76b16e229003,7654ec4a241c1fc6,2dd390c3a48a7ed0,10,KPMG,KPMG,KPMG,/q-KPMG-l-san-francisco-jobs.html,San Francisco,US,,San Francisco,Senior Associate,6cf5e6d389fd6d6b,Hn-YrsnGnu3NTWR3wHbwDpLiViVpIJxRTl3jkb0cVmypwaJhepPcBcZ-tZEK24Hg,"Historically, the travel requirement for this position has ranged from 80-100%. The safety and well-being of our people continues to be the top priority, and our decisions around travel are informed by government COVID-19 response directives, recommendations from leading health authorities, and guidance from a number of infectious disease experts. For now, all KPMG business travel, international and domestic, is currently restricted to client-essential sales/delivery activity only. At some point in the future and with the safety of people as the critical factor, the travel requirement will likely increase, possibly to previous levels, but KPMG is committed to balancing client requirements with new delivery capabilities.

The KPMG Advisory practice is currently our fastest growing practice. We are seeing tremendous client demand, and looking forward we don't anticipate that slowing down. In this ever-changing market environment, our professionals must be adaptable and thrive in a collaborative, team-driven culture. At KPMG, our people are our number one priority. With a wealth of learning and career development opportunities, a world-class training facility and leading market tools, we make sure our people continue to grow both professionally and personally. If you're looking for a firm with a strong team connection where you can be your whole self, have an impact, advance your skills, deepen your experiences, and have the flexibility and access to constantly find new areas of inspiration and expand your capabilities, then consider a career in Advisory.

KPMG is currently seeking a Senior Associate to join our KPMG Strategy practice.

Responsibilities:

Participate in enterprise-wide strategy engagements and help ensure successful delivery of final project deliverables

Interface with various levels of project executives up to and including C-Level

Drive problem formulation, comprehensive analysis and problem resolution

Establish client value propositions that tie key strategic, financial and operational metrics directly to near- and long-term business improvement

Research and study the client's business while critically dissecting the strategy and leading the development of insightful analysis

Qualifications:

Minimum three years of experience in a client-facing strategy discipline at a Big 4 firm, major strategy firm, or a boutique strategy firm and/or three years or more of work experience in a Strategy focused professional role in industry or in a private equity firm

Bachelor's degree from an accredited college/university, preferably in Business Administration, Engineering, or other related field; Master's degree in Business Administration from an accredited college/university is preferred

Experience across the following strategy areas: Market sizing, strategic planning, transaction and business due diligence, operational and performance improvement, strategic growth and/or other relevant strategy experience

Strong business acumen, with analytical and problem-solving skills and ability to understand how business model decisions impact operating model design/execution across operations, technology, risk governance and organizational design

Travel may be up to 80-100% post Covid



Applicants must be permanently authorized to work in the United States without the need for visa sponsorship now or in the future

KPMG LLP (the U.S. member firm of KPMG International) offers a comprehensive compensation and benefits package. KPMG is an affirmative action-equal opportunity employer. KPMG complies with all applicable federal, state and local laws regarding recruitment and hiring. All qualified applicants are considered for employment without regard to race, color, religion, age, sex, sexual orientation, gender identity, national origin, disability, protected veteran status, or any other category protected by applicable federal, state or local laws. The attached link contains further information regarding the firm's compliance with federal, state and local recruitment and hiring laws. No phone calls or agencies please.","{'kpmg': 0.015539460507896721, 'experience': 0.010136034906734329, 'strategy': 0.010024341331838828, 'business': 0.00891052562830118, 'project': 0.007495853462333698, 'historically': 0.004961844735650116, 'position': 0.004961844735650116, 'ranged': 0.004961844735650116, 'wellbeing': 0.004961844735650116, 'continues': 0.004961844735650116, 'top': 0.004961844735650116, 'around': 0.004961844735650116, 'informed': 0.004961844735650116, 'government': 0.004961844735650116, 'response': 0.004961844735650116, 'directives': 0.004961844735650116, 'recommendations': 0.004961844735650116, 'health': 0.004961844735650116, 'authorities': 0.004961844735650116, 'guidance': 0.004961844735650116, 'infectious': 0.004961844735650116, 'disease': 0.004961844735650116, 'experts': 0.004961844735650116, 'domestic': 0.004961844735650116, 'restricted': 0.004961844735650116, 'clientessential': 0.004961844735650116, 'salesdelivery': 0.004961844735650116, 'activity': 0.004961844735650116, 'point': 0.004961844735650116, 'critical': 0.004961844735650116, 'factor': 0.004961844735650116, 'likely': 0.004961844735650116, 'increase': 0.004961844735650116, 'possibly': 0.004961844735650116, 'previous': 0.004961844735650116, 'committed': 0.004961844735650116, 'balancing': 0.004961844735650116, 'requirements': 0.004961844735650116, 'fastest': 0.004961844735650116, 'growing': 0.004961844735650116, 'seeing': 0.004961844735650116, 'tremendous': 0.004961844735650116, 'demand': 0.004961844735650116, 'forward': 0.004961844735650116, 'dont': 0.004961844735650116, 'anticipate': 0.004961844735650116, 'slowing': 0.004961844735650116, 'everchanging': 0.004961844735650116, 'environment': 0.004961844735650116, 'professionals': 0.004961844735650116, 'adaptable': 0.004961844735650116, 'thrive': 0.004961844735650116, 'collaborative': 0.004961844735650116, 'teamdriven': 0.004961844735650116, 'culture': 0.004961844735650116, 'one': 0.004961844735650116, 'wealth': 0.004961844735650116, 'learning': 0.004961844735650116, 'opportunities': 0.004961844735650116, 'worldclass': 0.004961844735650116, 'training': 0.004961844735650116, 'facility': 0.004961844735650116, 'tools': 0.004961844735650116, 'make': 0.004961844735650116, 'sure': 0.004961844735650116, 'continue': 0.004961844735650116, 'grow': 0.004961844735650116, 'professionally': 0.004961844735650116, 'personally': 0.004961844735650116, 'youre': 0.004961844735650116, 'team': 0.004961844735650116, 'connection': 0.004961844735650116, 'whole': 0.004961844735650116, 'self': 0.004961844735650116, 'advance': 0.004961844735650116, 'deepen': 0.004961844735650116, 'experiences': 0.004961844735650116, 'flexibility': 0.004961844735650116, 'access': 0.004961844735650116, 'constantly': 0.004961844735650116, 'find': 0.004961844735650116, 'inspiration': 0.004961844735650116, 'expand': 0.004961844735650116, 'consider': 0.004961844735650116, 'seeking': 0.004961844735650116, 'senior': 0.004961844735650116, 'associate': 0.004961844735650116, 'join': 0.004961844735650116, 'responsibilities': 0.004961844735650116, 'participate': 0.004961844735650116, 'enterprisewide': 0.004961844735650116, 'engagements': 0.004961844735650116, 'help': 0.004961844735650116, 'ensure': 0.004961844735650116, 'successful': 0.004961844735650116, 'final': 0.004961844735650116, 'deliverables': 0.004961844735650116, 'interface': 0.004961844735650116, 'various': 0.004961844735650116, 'executives': 0.004961844735650116}"
ade231f0aa64fb58,035c76b16e229003,7654ec4a241c1fc6,2dd390c3a48a7ed0,11,KPMG,KPMG,KPMG,/q-KPMG-l-san-francisco-jobs.html,San Francisco,US,,San Francisco,Senior Associate,6cf5e6d389fd6d6b,VZ_wjdT_kZ9jhgNz9phN1eRE5BNV39Cyt6dMRRdxLbXILTSaErR9HmkkB9L45-rR,"Historically, the travel requirement for this position has ranged from 80-100%. The safety and well-being of our people continues to be the top priority, and our decisions around travel are informed by government COVID-19 response directives, recommendations from leading health authorities, and guidance from a number of infectious disease experts. For now, all KPMG business travel, international and domestic, is currently restricted to client-essential sales/delivery activity only. At some point in the future and with the safety of people as the critical factor, the travel requirement will likely increase, possibly to previous levels, but KPMG is committed to balancing client requirements with new delivery capabilities.

The KPMG Advisory practice is currently our fastest growing practice. We are seeing tremendous client demand, and looking forward we don't anticipate that slowing down. In this ever-changing market environment, our professionals must be adaptable and thrive in a collaborative, team-driven culture. At KPMG, our people are our number one priority. With a wealth of learning and career development opportunities, a world-class training facility and leading market tools, we make sure our people continue to grow both professionally and personally. If you're looking for a firm with a strong team connection where you can be your whole self, have an impact, advance your skills, deepen your experiences, and have the flexibility and access to constantly find new areas of inspiration and expand your capabilities, then consider a career in Advisory.

KPMG is currently seeking a Senior Associate to join our KPMG Strategy practice.

Responsibilities:

Participate in enterprise-wide strategy engagements and execute client project deliverables in the Technology, Media and Telecommunications industry

Interface with various levels of project executives up to and including C-Level

Drive problem formulation, comprehensive analysis and problem resolution

Establish client value propositions that tie key strategic, financial and operational metrics directly to near- and long-term business improvement

Support professional development of junior level KPMG Strategy team members

Qualifications:

Minimum three years of recent experience in a client-facing strategy discipline at a Big 4 firm, major strategy firm, or a boutique strategy firm in the Technology, Media and Telecommunications industry

Bachelor's degree from an accredited college/university, preferably in Business Administration, Engineering, or other related field; Master's degree in Business Administration from an accredited college/university is preferred

Experience in at least one of the following strategy consulting areas: transaction and business due diligence, operational and performance improvement, strategic growth, or other relevant strategy experience

Strong business acumen, with analytical and problem-solving skills and ability to understand how business model decisions impact operating model design/execution across operations, technology, risk governance and organizational design

Comfort with/knowledge of/experience in Technology, Media and Telecommunications, including Technology Strategy/Innovation, Software/Internet, Traditional/Digital Media & Entertainment

Travel may be up to 80-100%

Applicants must be currently authorized to work in the United States without the need for visa sponsorship now or in the future

KPMG LLP (the U.S. member firm of KPMG International) offers a comprehensive compensation and benefits package. KPMG is an affirmative action-equal opportunity employer. KPMG complies with all applicable federal, state and local laws regarding recruitment and hiring. All qualified applicants are considered for employment without regard to race, color, religion, age, sex, sexual orientation, gender identity, national origin, disability, protected veteran status, or any other category protected by applicable federal, state or local laws. The attached link contains further information regarding the firm's compliance with federal, state and local recruitment and hiring laws. No phone calls or agencies please.","{'kpmg': 0.01724440838340977, 'strategy': 0.008989240519010554, 'business': 0.007865585454134235, 'experience': 0.007669181888355082, 'project': 0.00756207124910343, 'technology': 0.006658761505091698, 'historically': 0.005005677286318403, 'position': 0.005005677286318403, 'ranged': 0.005005677286318403, 'wellbeing': 0.005005677286318403, 'continues': 0.005005677286318403, 'top': 0.005005677286318403, 'around': 0.005005677286318403, 'informed': 0.005005677286318403, 'government': 0.005005677286318403, 'response': 0.005005677286318403, 'directives': 0.005005677286318403, 'recommendations': 0.005005677286318403, 'health': 0.005005677286318403, 'authorities': 0.005005677286318403, 'guidance': 0.005005677286318403, 'infectious': 0.005005677286318403, 'disease': 0.005005677286318403, 'experts': 0.005005677286318403, 'domestic': 0.005005677286318403, 'restricted': 0.005005677286318403, 'clientessential': 0.005005677286318403, 'salesdelivery': 0.005005677286318403, 'activity': 0.005005677286318403, 'point': 0.005005677286318403, 'critical': 0.005005677286318403, 'factor': 0.005005677286318403, 'likely': 0.005005677286318403, 'increase': 0.005005677286318403, 'possibly': 0.005005677286318403, 'previous': 0.005005677286318403, 'committed': 0.005005677286318403, 'balancing': 0.005005677286318403, 'requirements': 0.005005677286318403, 'delivery': 0.005005677286318403, 'fastest': 0.005005677286318403, 'growing': 0.005005677286318403, 'seeing': 0.005005677286318403, 'tremendous': 0.005005677286318403, 'demand': 0.005005677286318403, 'forward': 0.005005677286318403, 'dont': 0.005005677286318403, 'anticipate': 0.005005677286318403, 'slowing': 0.005005677286318403, 'everchanging': 0.005005677286318403, 'environment': 0.005005677286318403, 'professionals': 0.005005677286318403, 'adaptable': 0.005005677286318403, 'thrive': 0.005005677286318403, 'collaborative': 0.005005677286318403, 'teamdriven': 0.005005677286318403, 'culture': 0.005005677286318403, 'wealth': 0.005005677286318403, 'learning': 0.005005677286318403, 'opportunities': 0.005005677286318403, 'worldclass': 0.005005677286318403, 'training': 0.005005677286318403, 'facility': 0.005005677286318403, 'tools': 0.005005677286318403, 'make': 0.005005677286318403, 'sure': 0.005005677286318403, 'continue': 0.005005677286318403, 'grow': 0.005005677286318403, 'professionally': 0.005005677286318403, 'personally': 0.005005677286318403, 'youre': 0.005005677286318403, 'connection': 0.005005677286318403, 'whole': 0.005005677286318403, 'self': 0.005005677286318403, 'advance': 0.005005677286318403, 'deepen': 0.005005677286318403, 'experiences': 0.005005677286318403, 'flexibility': 0.005005677286318403, 'access': 0.005005677286318403, 'constantly': 0.005005677286318403, 'find': 0.005005677286318403, 'inspiration': 0.005005677286318403, 'expand': 0.005005677286318403, 'consider': 0.005005677286318403, 'seeking': 0.005005677286318403, 'senior': 0.005005677286318403, 'associate': 0.005005677286318403, 'join': 0.005005677286318403, 'responsibilities': 0.005005677286318403, 'participate': 0.005005677286318403, 'enterprisewide': 0.005005677286318403, 'engagements': 0.005005677286318403, 'execute': 0.005005677286318403, 'deliverables': 0.005005677286318403, 'interface': 0.005005677286318403, 'various': 0.005005677286318403, 'executives': 0.005005677286318403, 'clevel': 0.005005677286318403, 'drive': 0.005005677286318403, 'formulation': 0.005005677286318403}"
