jk,efccid,srcid,cmpid,num,srcname,cmp,cmpesc,cmplnk,loc,country,zip,city,title,locid,rd,description,keywords
4a8cd3fb7b98e314,51a5d8026401bdd1,1f4216b3180796f2,5d307319eb6a3a00,8,Volta Charging,Volta Charging,Volta Charging,/q-Volta-Charging-l-san-francisco-jobs.html,San Francisco,US,,San Francisco,Associate,6cf5e6d389fd6d6b,kvOl39fEzGksKTLeOJNc85Cy0TcQ-at8r-4lt_ptucxAB0Txou_JHMU_HnLHml5s,"Volta set out to accelerate the adoption of the electric vehicle, by building the most utilized EV charging network in the US – offering charging to drivers wherever they live, shop, work, and play. Our stations double as a content and media platform, increasing the value of real estate by engaging new audiences and telling high impact stories using sustainable technology.

Volta's award-winning charging stations benefit brands, consumers, and real-estate locations by providing valuable advertising space to businesses and convenient charging to drivers. Strategically located in places consumers already visit, Volta's chargers are the most used EV charging stations in the United States. And we’re just getting started.

The Opportunity at Volta Charging

We are seeking an Associate to be one of the early Team Members of a new Corporate Strategy & Development team at Volta. The Corporate Strategy & Development team works closely with senior leaders across Volta to help accelerate the company’s mission through partnerships, M&A and investments, and other strategic initiatives. The Corporate Strategy & Development team is responsible for developing new business opportunities through both organic and inorganic growth, including originating new business ventures and partnerships, as well as negotiating, structuring, and executing impactful acquisitions. Over time, the selected candidate will assist in supporting our business units and senior leadership by conducting industry research, valuation analyses, due diligence, creation of strategic recommendations, acquisition term sheet and contract negotiations, and both internal and external relationship building, including VCs and bankers throughout the electric mobility space and beyond.


In your first 90 days, you will

Develop a strong understanding of the Volta company strategy and business model, as well as begin to educate oneself on the larger core and peripheral industries

Build cross functional relationships with Volta’s various business unit leaders and begin to understand their respective product and program strategies

Dive into existing Corporate Development workstreams, supporting senior team members on a portfolio of work and delivering meaningful results over the period

Conduct market research and perform ad-hoc qualitative and quantitative analysis for strategic planning, partnerships, and business development efforts

Begin to evaluate white space business, product, and partnership opportunities in core and adjacent markets and begin to build the landscaping and strategic roadmap for target industries and opportunities


After twelve months, you will have accomplished

Mastery of the Volta company strategy and business model with a deep understanding of the opportunity and risk of Volta’s current and future platform and product, customer, and geographic footprint

Developing a strong understanding of external market dynamics including robust network of professional connections in the space

Completing evaluation of white space business, product, and partnership opportunities in core and adjacent markets, including full landscaping of competitive environment and strategic roadmap for target industries and opportunities

Assisting in developing a deal pipeline, including outreach to and sourcing of new opportunities

Assisting on deal negotiation, due diligence and integration efforts for acquisitions, including coordinating cross-functional product, engineering, and functional teams to evaluate targets

Measurable enterprise value accretion from personal portfolio of work, including “build, buy, partner” opportunities brought from origination to execution


What you bring to Volta Charging

3-5 years of experience in investment banking, private equity, corporate strategy, corporate development, strategic finance/ FP&A, management consulting, and/or other related fields

Extremely strong analytical and financial modeling skills (ability to construct business cases with complex operating, financial, and valuation models to evaluate transaction economics and perform sensitivity analysis)

An ability and passion to dig deep into the data, thinking from first principles, and delivering the best results

Excellent verbal and written communication skills and the ability to convey complex ideas in a clear, concise manner to senior level executives

A low ego individual with a proven track record of working well across teams and with external partners to solve hard problems

A deep understanding of markets, competition, and how to leverage core competencies to create defensible strategies

A passion for technology and an understanding of the electric mobility space and energy/ utility space, trends, and dynamics

A self-starter mentality with the ability to work autonomously to drive projects to completion","{'adjacent': 0.006925067948854274, 'external': 0.0054314562601170055, 'business': 0.005363532991559885, 'work': 0.004169306349232754, 'acquisitions': 0.0036209708400780035, 'complex': 0.0036209708400780035, 'set': 0.003462533974427137, 'adoption': 0.003462533974427137, 'vehicle': 0.003462533974427137, 'utilized': 0.003462533974427137, 'us': 0.003462533974427137, 'offering': 0.003462533974427137, 'wherever': 0.003462533974427137, 'live': 0.003462533974427137, 'shop': 0.003462533974427137, 'play': 0.003462533974427137, 'double': 0.003462533974427137, 'content': 0.003462533974427137, 'media': 0.003462533974427137, 'increasing': 0.003462533974427137, 'real': 0.003462533974427137, 'estate': 0.003462533974427137, 'engaging': 0.003462533974427137, 'audiences': 0.003462533974427137, 'telling': 0.003462533974427137, 'high': 0.003462533974427137, 'impact': 0.003462533974427137, 'stories': 0.003462533974427137, 'using': 0.003462533974427137, 'sustainable': 0.003462533974427137, 'awardwinning': 0.003462533974427137, 'benefit': 0.003462533974427137, 'brands': 0.003462533974427137, 'realestate': 0.003462533974427137, 'locations': 0.003462533974427137, 'providing': 0.003462533974427137, 'valuable': 0.003462533974427137, 'advertising': 0.003462533974427137, 'businesses': 0.003462533974427137, 'convenient': 0.003462533974427137, 'strategically': 0.003462533974427137, 'located': 0.003462533974427137, 'places': 0.003462533974427137, 'already': 0.003462533974427137, 'visit': 0.003462533974427137, 'chargers': 0.003462533974427137, 'used': 0.003462533974427137, 'united': 0.003462533974427137, 'states': 0.003462533974427137, 'getting': 0.003462533974427137, 'started': 0.003462533974427137, 'seeking': 0.003462533974427137, 'associate': 0.003462533974427137, 'one': 0.003462533974427137, 'early': 0.003462533974427137, 'works': 0.003462533974427137, 'closely': 0.003462533974427137, 'help': 0.003462533974427137, 'mission': 0.003462533974427137, 'investments': 0.003462533974427137, 'initiatives': 0.003462533974427137, 'responsible': 0.003462533974427137, 'organic': 0.003462533974427137, 'inorganic': 0.003462533974427137, 'growth': 0.003462533974427137, 'originating': 0.003462533974427137, 'ventures': 0.003462533974427137, 'negotiating': 0.003462533974427137, 'structuring': 0.003462533974427137, 'executing': 0.003462533974427137, 'impactful': 0.003462533974427137, 'time': 0.003462533974427137, 'selected': 0.003462533974427137, 'candidate': 0.003462533974427137, 'assist': 0.003462533974427137, 'units': 0.003462533974427137, 'leadership': 0.003462533974427137, 'conducting': 0.003462533974427137, 'industry': 0.003462533974427137, 'analyses': 0.003462533974427137, 'creation': 0.003462533974427137, 'recommendations': 0.003462533974427137, 'acquisition': 0.003462533974427137, 'term': 0.003462533974427137, 'sheet': 0.003462533974427137, 'contract': 0.003462533974427137, 'negotiations': 0.003462533974427137, 'internal': 0.003462533974427137, 'relationship': 0.003462533974427137, 'vcs': 0.003462533974427137, 'bankers': 0.003462533974427137, 'throughout': 0.003462533974427137, 'beyond': 0.003462533974427137, 'days': 0.003462533974427137, 'develop': 0.003462533974427137, 'educate': 0.003462533974427137, 'oneself': 0.003462533974427137, 'larger': 0.003462533974427137, 'peripheral': 0.003462533974427137, 'cross': 0.003462533974427137}"
5472afa854afc314,8b979ddd69dc88d9,912750692bdd6122,78bbcd26e39621f5,9,Wells Fargo,Wells Fargo,Wells Fargo,/q-Wells-Fargo-l-san-francisco-jobs.html,San Francisco,US,,San Francisco,Brand Experiences Support Associate,6cf5e6d389fd6d6b,Af-g-DNr68UlRDtmhxKwdNpa4Kuz6of5bx1T8hiCXZSD1I66D1a-9ajpcgytaSbC,"Job Description

Important Note: During the application process, ensure your contact information (email and phone number) is up to date and upload your current resume when submitting your application for consideration. To participate in some selection activities you will need to respond to an invitation. The invitation can be sent by both email and text message. In order to receive text message invitations, your profile must include a mobile phone number designated as “Personal Cell” or “Cellular” in the contact information of your application.

At Wells Fargo, we are looking for talented people who will put our customers at the center of everything we do. We are seeking candidates who embrace diversity, equity and inclusion in a workplace where everyone feels valued and inspired.

Help us build a better Wells Fargo. It all begins with outstanding talent. It all begins with you.

Public Affairs builds trust, brand reputation, and positive business results for Wells Fargo. We enhance the company's societal impact and sustainability, execute strategic communications and brand management, and advocate for Wells Fargo's business priorities.

Communications & Brand Management delivers strategic internal, external, and executive communications for Wells Fargo and is responsible for driving the company's brand strategy. The team provides world-class counsel to accelerate the business and deliver relevant content to build trust, drive stakeholder perception, and protect and enhance the company's reputation.

This newly created position will primarily focus on performing work to support the operations of the Branded Experiences programs – including San Francisco Museum and Stagecoach Experiences Program. This person will focus on opportunities to promote and protect Wells Fargo’s reputation through strategic engagement with internal and external stakeholders. Preference is for this position to sit in San Francisco, CA and relocation assistance is not available. The Wells Fargo job code title for this position is a Business Support Associate 2.

Specific responsibilities include:


Provides support for a variety of diverse support functions and/or operations/production oversight for Branded Experiences Programs
Administers programs, projects or processes specific to the business and maintains spreadsheets or databases to monitor departmental information
Coordinates and monitors implementation and maintenance of processes, procedures, and policies
Prepares correspondence; memorandum; reports; presentations or other assigned documentation
Records documentation and management including reporting, analysis and adherence to compliance regulations
Manage calendars and scheduling for Museum Programs, Events and Tours. Support Stagecoach Experience program with event & program administration. Serve on and support a broad-range of ad hoc high-priority initiatives, primarily to scope, research and identify options/recommendations
Analyze complex data and/or create reports (i.e. tracking performance of key program initiatives) based on complex data, including transforming data into consumable management-level material
Participate in ad-hoc internal strategic planning activities across the Branded Experiences Office
Develop working relationships with internal business partners and be seen as a trusted advisor
May participate in special projects as needed including support of programs and events for the Branded Experiences team

Depending on the volume of applications received, this job posting may be removed prior to the indicated close date.

Required Qualifications

2+ years of experience in one or a combination of the following: administrative support, project management, implementation, business operations or strategic planning demonstrated through work or military experience

Other Desired Qualifications



 
Experience Research, Reporting and analysis for various program efforts and test & learn activities

 
Experience Invoice Processing and Management

 
Experience with Procurement and inventory records management.

 
Experience Managing Annual Renewal of various partnerships and partner memberships

 
Experience Management of Fleet Reporting and DOT Registration Renewals.

 
Experience Record Retention and Record management

 
Experience Scheduling and Oversight of various cross functional and planning team meetings

 
Experience Managing external facing email accounts, requests for services and client communications

 
Experience Presentation development

 
Proficient in Microsoft Teams and Microsoft Office



Job Expectations

Ability to travel up to 10% of the time

Salary Information

The salary range displayed below is based on a Full-time 40 hour a week schedule.




CA-SF-Financial District: 
Min: $60,500 Mid: $84,000 Max: $107,500

Street Address

CA-SF-Financial District: 
420 Montgomery - San Francisco, CA","{'experience': 0.013634102323471217, 'job': 0.011347253645500373, 'wells': 0.007085890513694502, 'qualifications': 0.006564283393808332, 'experiences': 0.0056808759681130075, 'projects': 0.005673626822750187, 'description': 0.004982779914656657, 'important': 0.004982779914656657, 'note': 0.004982779914656657, 'process': 0.004982779914656657, 'ensure': 0.004982779914656657, 'upload': 0.004982779914656657, 'current': 0.004982779914656657, 'resume': 0.004982779914656657, 'submitting': 0.004982779914656657, 'consideration': 0.004982779914656657, 'selection': 0.004982779914656657, 'need': 0.004982779914656657, 'respond': 0.004982779914656657, 'sent': 0.004982779914656657, 'order': 0.004982779914656657, 'receive': 0.004982779914656657, 'invitations': 0.004982779914656657, 'profile': 0.004982779914656657, 'must': 0.004982779914656657, 'mobile': 0.004982779914656657, 'designated': 0.004982779914656657, 'looking': 0.004982779914656657, 'talented': 0.004982779914656657, 'people': 0.004982779914656657, 'put': 0.004982779914656657, 'customers': 0.004982779914656657, 'center': 0.004982779914656657, 'everything': 0.004982779914656657, 'seeking': 0.004982779914656657, 'candidates': 0.004982779914656657, 'embrace': 0.004982779914656657, 'diversity': 0.004982779914656657, 'equity': 0.004982779914656657, 'inclusion': 0.004982779914656657, 'workplace': 0.004982779914656657, 'everyone': 0.004982779914656657, 'feels': 0.004982779914656657, 'valued': 0.004982779914656657, 'inspired': 0.004982779914656657, 'help': 0.004982779914656657, 'us': 0.004982779914656657, 'better': 0.004982779914656657, 'outstanding': 0.004982779914656657, 'talent': 0.004982779914656657, 'public': 0.004982779914656657, 'affairs': 0.004982779914656657, 'builds': 0.004982779914656657, 'positive': 0.004982779914656657, 'results': 0.004982779914656657, 'societal': 0.004982779914656657, 'impact': 0.004982779914656657, 'sustainability': 0.004982779914656657, 'execute': 0.004982779914656657, 'advocate': 0.004982779914656657, 'fargos': 0.004982779914656657, 'priorities': 0.004982779914656657, 'delivers': 0.004982779914656657, 'executive': 0.004982779914656657, 'responsible': 0.004982779914656657, 'driving': 0.004982779914656657, 'strategy': 0.004982779914656657, 'worldclass': 0.004982779914656657, 'counsel': 0.004982779914656657, 'accelerate': 0.004982779914656657, 'deliver': 0.004982779914656657, 'relevant': 0.004982779914656657, 'content': 0.004982779914656657, 'drive': 0.004982779914656657, 'stakeholder': 0.004982779914656657, 'perception': 0.004982779914656657, 'newly': 0.004982779914656657, 'created': 0.004982779914656657, 'performing': 0.004982779914656657, 'person': 0.004982779914656657, 'opportunities': 0.004982779914656657, 'promote': 0.004982779914656657, 'engagement': 0.004982779914656657, 'stakeholders': 0.004982779914656657, 'preference': 0.004982779914656657, 'sit': 0.004982779914656657, 'relocation': 0.004982779914656657, 'assistance': 0.004982779914656657, 'available': 0.004982779914656657, 'code': 0.004982779914656657, 'title': 0.004982779914656657, 'associate': 0.004982779914656657, 'responsibilities': 0.004982779914656657, 'variety': 0.004982779914656657, 'diverse': 0.004982779914656657, 'functions': 0.004982779914656657, 'operationsproduction': 0.004982779914656657, 'administers': 0.004982779914656657, 'maintains': 0.004982779914656657, 'spreadsheets': 0.004982779914656657}"
739e8d07bc7755d4,a5c4e484fc7f107e,2c4bf819fe7e6213,f60ad08001838014,10,Embark Trucks,Embark Trucks,Embark Trucks,/q-Embark-Trucks-l-san-francisco-jobs.html,San Francisco,US,,San Francisco,Strategy and Business Operations Associate,6cf5e6d389fd6d6b,dVXz9Nz68xf_zK33PIRykjv3k2jq4lDtqGKimPVwGX8MEOGjJMq6wm4Hvr-R6m0p,"Embark Trucks is America’s Longest-Running Self-Driving Truck Program and is bringing autonomous freight mainstream. As covered by the Wall Street Journal, CNBC, Forbes, TechCrunch and and other outlets, Embark has announced plans to go public via a $5.2 billion SPAC deal that is intended to provide Embark $614 million to fund future expansion. Currently, Embark moves freight between LA and Phoenix using our purpose-built transfer hubs. Embark has aligned itself with truck manufacturers, shippers, and carriers to integrate our technology into the freight ecosystem, pursuing a business model where fleets own and operate Embark trucks. This is an incredibly exciting time for autonomous vehicles and our team is looking to grow.

We are looking for an Associate to join the Business Operations and Strategy team who will tackle cross-functional projects across Product, People, Operations, BD, Finance, and more. This position, reporting to the Head of Business Operations and Strategy, will work closely with the leadership of these teams, focusing on areas such as owning special projects, providing analytical support, and defining key metrics. Your mission is to help Embark make better, data-driven decisions across the organization.


Working Across a Multitude of Projects:

Work with cross-functional leadership to establish metrics and milestones and help define a strategic North Star for these teams

Building processes within our supply chain to scale production

Improving the efficiency of data collection from the testing of our trucks

Forecasting and planning headcount

Establish processes across a variety of functions to help us grow efficiently and sustainably


Experience Might Include:

2-4 years experience in management consulting, investment banking, or business operations in tech companies and/or startups

Proven experience working effectively in a highly cross-functional team

An ego-free attitude that in the same day can go from presenting and interfacing with C-Suite leadership to understanding the needs of our on-the-ground operational staff

An analytical mentality where the first instinct is to back up a case with empirical evidence

A track record of successfully owning projects from start to finish, especially where the mandate is ambiguous and evolving

Demonstrated curiosity with the ability to think of outside-the-box solutions to difficult problems


Nice to Have:

SQL proficiency

Experience with business intelligence and data visualization tools (Tableau, Looker, etc.)


Embark in the Press:

CNBC - Our Partner Development Program

Forbes - The Embark Universal Interface

Navigating Highway Work Zones with the Embark Driver

Forbes - 70 Million Dollar Series C

Video - Day in the life of a self-driving truck

30 Million Dollar Series B led by Sequoia","{'experience': 0.01581757162097396, 'projects': 0.011832656553571854, 'longestrunning': 0.005657457230943601, 'bringing': 0.005657457230943601, 'mainstream': 0.005657457230943601, 'covered': 0.005657457230943601, 'wall': 0.005657457230943601, 'street': 0.005657457230943601, 'journal': 0.005657457230943601, 'techcrunch': 0.005657457230943601, 'outlets': 0.005657457230943601, 'announced': 0.005657457230943601, 'plans': 0.005657457230943601, 'public': 0.005657457230943601, 'via': 0.005657457230943601, 'billion': 0.005657457230943601, 'spac': 0.005657457230943601, 'deal': 0.005657457230943601, 'intended': 0.005657457230943601, 'provide': 0.005657457230943601, 'fund': 0.005657457230943601, 'future': 0.005657457230943601, 'expansion': 0.005657457230943601, 'currently': 0.005657457230943601, 'moves': 0.005657457230943601, 'la': 0.005657457230943601, 'phoenix': 0.005657457230943601, 'using': 0.005657457230943601, 'purposebuilt': 0.005657457230943601, 'transfer': 0.005657457230943601, 'hubs': 0.005657457230943601, 'aligned': 0.005657457230943601, 'manufacturers': 0.005657457230943601, 'shippers': 0.005657457230943601, 'carriers': 0.005657457230943601, 'integrate': 0.005657457230943601, 'technology': 0.005657457230943601, 'ecosystem': 0.005657457230943601, 'pursuing': 0.005657457230943601, 'model': 0.005657457230943601, 'fleets': 0.005657457230943601, 'operate': 0.005657457230943601, 'incredibly': 0.005657457230943601, 'exciting': 0.005657457230943601, 'time': 0.005657457230943601, 'vehicles': 0.005657457230943601, 'associate': 0.005657457230943601, 'join': 0.005657457230943601, 'tackle': 0.005657457230943601, 'product': 0.005657457230943601, 'people': 0.005657457230943601, 'bd': 0.005657457230943601, 'finance': 0.005657457230943601, 'position': 0.005657457230943601, 'reporting': 0.005657457230943601, 'head': 0.005657457230943601, 'closely': 0.005657457230943601, 'focusing': 0.005657457230943601, 'areas': 0.005657457230943601, 'special': 0.005657457230943601, 'providing': 0.005657457230943601, 'support': 0.005657457230943601, 'defining': 0.005657457230943601, 'key': 0.005657457230943601, 'mission': 0.005657457230943601, 'make': 0.005657457230943601, 'better': 0.005657457230943601, 'datadriven': 0.005657457230943601, 'decisions': 0.005657457230943601, 'organization': 0.005657457230943601, 'multitude': 0.005657457230943601, 'milestones': 0.005657457230943601, 'define': 0.005657457230943601, 'strategic': 0.005657457230943601, 'north': 0.005657457230943601, 'star': 0.005657457230943601, 'building': 0.005657457230943601, 'within': 0.005657457230943601, 'supply': 0.005657457230943601, 'chain': 0.005657457230943601, 'scale': 0.005657457230943601, 'production': 0.005657457230943601, 'improving': 0.005657457230943601, 'efficiency': 0.005657457230943601, 'collection': 0.005657457230943601, 'testing': 0.005657457230943601, 'forecasting': 0.005657457230943601, 'planning': 0.005657457230943601, 'headcount': 0.005657457230943601, 'variety': 0.005657457230943601, 'functions': 0.005657457230943601, 'us': 0.005657457230943601, 'efficiently': 0.005657457230943601, 'sustainably': 0.005657457230943601, 'might': 0.005657457230943601, 'include': 0.005657457230943601, 'years': 0.005657457230943601, 'management': 0.005657457230943601, 'consulting': 0.005657457230943601, 'investment': 0.005657457230943601}"
