jk,efccid,srcid,cmpid,num,srcname,cmp,cmpesc,cmplnk,loc,country,zip,city,title,locid,rd,description,keywords
3844f4508089c0e2,8cd10f69280ad739,b4dc1ba297b335b6,2892a4dbb6281f34,0,DoorDash,DoorDash,DoorDash,/q-DoorDash-l-san-francisco-jobs.html,San Francisco,US,,San Francisco,Strategy &amp; Operations Associate &amp; Senior Associate,6cf5e6d389fd6d6b,E4fhWX_aAFqF37QMCtQEyhxNNjPrsTulYVJeVzSI4sbdRF9y0fgpqTUnAE_NfIFS,"About the Team

The Strategy & Operations team oversees strategic growth at DoorDash. Together, we're building the world's most efficient and reliable same-day logistics platform to fulfill our vision of empowering all local businesses. Strategy and Operations Associates establish the value of new projects, and run experiments to build the future of Consumer, Dasher, and Merchant experiences on the DoorDash platform. You will dive into data to explain delivery quality performance at the lowest level of detail, create strategies, work side-by-side with external teams and manage a team of specialists to make those a reality.

About the Role

Our best Associates are truth seekers who enjoy solving difficult problems, working across the organization and affecting change every day. They combine business context and analytics to take a problem area and implement a customized solution. Think this is you? Read on…

Roles:

S&O Senior Associate

S&O Associate

You're excited about this opportunity because you will…

Analyze
 – Build models to evaluate the costs and benefits of different Dasher projects and experiments.

Strategize
 – You'll develop strategies for best serving our customers.

Collaborate
 – Influence and engage across the company - partner with our Operations, Merchant, Finance, Product, Engineering, and Analytics teams to implement strategy

Build and Experiment
 – You'll have your fingerprints all over the future of DoorDash Logistics. This means everything from high-level strategy to the operational details.

We're excited about you because…

You want to affect change every day and can operate in energizing environments

You enjoy solving problems and can translate high-level goals into executional plans

You want to oversee the outcome and help improve our most important growth and profitability metrics

You seek exposure to different types of problems and want to try your hand at different sides of the business

You have an ability to build partnerships at all levels across a variety of responsibilities to achieve common goals

You are excited to shape the direction of the company

You have completed your Bachelor's degree and have 1+ years work experience in banking, consulting, bizops, strategy, operations, technology, startups, or related experiences

You have advanced Excel skills (can perform complex functions)

Why You'll Love Working at DoorDash

We are leaders
 – Leadership is not limited to our management team. It's something everyone at DoorDash embraces and embodies.

We are operators
 – We believe the only way to predict the future is to build it. Creating solutions to lead our company and our industry is what we do on every project, every day.

We are learners
 – Everyone here is continually learning on the job, no matter if we've been in a role for one year or one minute. We are committed to learning and implementing what is best for our customers, merchants, and dashers.

We are one team
 – The magic of DoorDash is our people, together making our inspiring goals attainable and driving us to greater heights.

About DoorDash

At DoorDash, our mission to empower local economies shapes how our team members move quickly and always learn and reiterate to support merchants, Dashers and the communities we serve. We are a technology and logistics company that started with door-to-door delivery, and we are looking for team members who can help us go from a company that is known for delivering food to a company that people turn to for any and all goods. Read more on the DoorDash website, the DoorDash blog, the DoorDash Engineering blog, and the DoorDash Careers page.

DoorDash is growing rapidly and changing constantly, which gives our team members the opportunity to share their unique perspectives, solve new challenges, and own their careers. Our leaders seek the truth and welcome big, hairy, audacious questions. We are grounded in our company values, and we make intentional decisions that are both logical and display empathy for our range of users—from Dashers to Merchants to Customers.

We're committed to supporting employees' happiness, healthiness, and overall well-being by providing comprehensive benefits and perks including premium healthcare, wellness expense reimbursement, paid parental leave, and more.

Our Commitment to Diversity and Inclusion

We're committed to growing and empowering a more inclusive community within our company, industry, and cities. That's why we hire and cultivate diverse teams of people from all backgrounds, experiences, and perspectives. We believe that true innovation happens when everyone has room at the table and the tools, resources, and opportunity to excel.","{'company': 0.004957450235949949, 'projects': 0.004832444874449098, 'experiences': 0.004775511638873707, 'excited': 0.004775511638873707, 'oversees': 0.004673498611746429, 'strategic': 0.004673498611746429, 'building': 0.004673498611746429, 'worlds': 0.004673498611746429, 'efficient': 0.004673498611746429, 'reliable': 0.004673498611746429, 'sameday': 0.004673498611746429, 'fulfill': 0.004673498611746429, 'vision': 0.004673498611746429, 'businesses': 0.004673498611746429, 'establish': 0.004673498611746429, 'value': 0.004673498611746429, 'run': 0.004673498611746429, 'consumer': 0.004673498611746429, 'dive': 0.004673498611746429, 'data': 0.004673498611746429, 'explain': 0.004673498611746429, 'quality': 0.004673498611746429, 'performance': 0.004673498611746429, 'lowest': 0.004673498611746429, 'level': 0.004673498611746429, 'detail': 0.004673498611746429, 'create': 0.004673498611746429, 'sidebyside': 0.004673498611746429, 'external': 0.004673498611746429, 'manage': 0.004673498611746429, 'specialists': 0.004673498611746429, 'reality': 0.004673498611746429, 'seekers': 0.004673498611746429, 'difficult': 0.004673498611746429, 'organization': 0.004673498611746429, 'affecting': 0.004673498611746429, 'combine': 0.004673498611746429, 'context': 0.004673498611746429, 'take': 0.004673498611746429, 'problem': 0.004673498611746429, 'area': 0.004673498611746429, 'customized': 0.004673498611746429, 'solution': 0.004673498611746429, 'think': 0.004673498611746429, 'roles': 0.004673498611746429, 'senior': 0.004673498611746429, 'youre': 0.004673498611746429, 'analyze': 0.004673498611746429, 'models': 0.004673498611746429, 'evaluate': 0.004673498611746429, 'costs': 0.004673498611746429, 'strategize': 0.004673498611746429, 'develop': 0.004673498611746429, 'serving': 0.004673498611746429, 'collaborate': 0.004673498611746429, 'influence': 0.004673498611746429, 'engage': 0.004673498611746429, 'partner': 0.004673498611746429, 'finance': 0.004673498611746429, 'product': 0.004673498611746429, 'experiment': 0.004673498611746429, 'fingerprints': 0.004673498611746429, 'means': 0.004673498611746429, 'everything': 0.004673498611746429, 'operational': 0.004673498611746429, 'details': 0.004673498611746429, 'affect': 0.004673498611746429, 'operate': 0.004673498611746429, 'energizing': 0.004673498611746429, 'environments': 0.004673498611746429, 'translate': 0.004673498611746429, 'executional': 0.004673498611746429, 'plans': 0.004673498611746429, 'oversee': 0.004673498611746429, 'outcome': 0.004673498611746429, 'improve': 0.004673498611746429, 'important': 0.004673498611746429, 'profitability': 0.004673498611746429, 'metrics': 0.004673498611746429, 'exposure': 0.004673498611746429, 'types': 0.004673498611746429, 'try': 0.004673498611746429, 'hand': 0.004673498611746429, 'sides': 0.004673498611746429, 'ability': 0.004673498611746429, 'partnerships': 0.004673498611746429, 'levels': 0.004673498611746429, 'variety': 0.004673498611746429, 'responsibilities': 0.004673498611746429, 'achieve': 0.004673498611746429, 'common': 0.004673498611746429, 'shape': 0.004673498611746429, 'direction': 0.004673498611746429, 'completed': 0.004673498611746429, 'bachelors': 0.004673498611746429, 'degree': 0.004673498611746429, 'years': 0.004673498611746429, 'experience': 0.004673498611746429, 'banking': 0.004673498611746429, 'consulting': 0.004673498611746429}"
a04423fa6aaa6c56,8cd10f69280ad739,b4dc1ba297b335b6,2892a4dbb6281f34,1,DoorDash,DoorDash,DoorDash,/q-DoorDash-l-san-francisco-jobs.html,San Francisco,US,,San Francisco,Senior Associate,6cf5e6d389fd6d6b,E4fhWX_aAFqF37QMCtQEyhxNNjPrsTulYVJeVzSI4sbdRF9y0fgpqTUnAE_NfIFS,"The Strategy & Operations team oversees strategic growth at DoorDash. Strategy & Operations Senior Associates establish the value of new plans, and run and refine experiments to increase growth. You will dive into data to explain market performance at the lowest level of detail, create strategies, and work side-by-side with external teams to make those a reality.

Our best Senior Associates are data-driven, truth seekers and strategic partners, operators/ They combine business context and analytics to take a problem area and implement a customized solution. Think this is you?

The takeout market is enormous, with $100B+ of annual spend. DoorDash is investing in new ways to help merchants produce high margin sales, and help consumers have great rewarding dining experiences. You will report to the Senior Manager, Strategy & Operations and will lead projects to incubate and grow our pickup/takeout/in-store businesses.

In a typical day, you may create customer growth strategies, develop plans to attract top merchants, lead new product ideas or rollouts, run experiments to improve operations, dive into data to explain performance at the lowest level of detail, and make sure we never stop growing.

You're excited about this opportunity because you will...

Strategize - Create and refine unique strategies across our Pickup marketplace

Engage - improve the way we onboard, work with, and build relationships with our merchants and strategic partners

Implement – create and launch scalable programs across teams

Experiment – Use data to run tests on everything from growth strategies to the selection of merchants on the platform

Analyze – Build models to evaluate the economic and strategic costs and benefits of multiple programs and experiments.

Influence – Work with our Business Development, Sales, Account Management, Operations, Product, Engineering, Analytics, Merchant, and Marketing. teams to guide strategic projects and harness opportunities

Build — create go-to-market playbooks, experimenting with new tactics to promote product adoption

We're excited about you because…


3+ years of experience
 managing
 projects in relevant industries; Plus for high-growth startup experience

You resist ""this is how it's always been done"" thinking 
You like being presented with a problem and coming up with a strategy to find a solution in creative ways- you resist ""this is how it's always been done"" thinking.

You're equally comfortable operating at 10,000 feet and 1 foot
. You don't hesitate to get in the weeds and operate at the lowest level of detail, but you're also comfortable thinking long-term and inspiring a team.

You find rapid change and learning exciting 
You excel in environments where no two days are the same

You find rapid change and learning exciting 
You excel in environments where no two days are the same

You let data win arguments
 you're comfortable pulling your data in SQL or modeling in Excel (can perform complex functions).

Why You'll Love Working at DoorDash

We are leaders
 - Leadership is not limited to our management team. It's something everyone at DoorDash embraces and embodies.

We create solutions 
we believe the only way to predict the future is to build it. Creating solutions to lead our company and our industry is what we do - on every project, every day.

We are learning
 - We're not afraid to dig in and uncover the truth, even if it's scary or inconvenient. Everyone here is learning on the job, no matter if we've been in a role for one year or one minute.

We are customer obsessed
 - Our mission is to grow and empower local economies. We are committed to our customers, merchants, and dashers and believe in connecting people with possibility.

We are all DoorDash
 - The magic of DoorDash is our people, together making our inspiring goals attainable and driving us to greater heights.

We offer great compensation packages and comprehensive health benefits.

About DoorDash

DoorDash is a technology company that connects customers with their favorite local and national businesses in over 4,000 cities and all 50 states across the United States and Canada. Founded in 2013, DoorDash empowers merchants to grow their businesses by offering on-demand delivery, data-driven insights, and better in-store efficiency, providing delightful experiences from door to door. By building the last-mile delivery infrastructure for local cities, DoorDash is bringing communities closer, one doorstep at a time. Read more on the DoorDash blog or at www.doordash.com.

Our Commitment to Diversity and Inclusion

We're committed to growing and empowering a more inclusive community within our company, industry, and cities. That's why we hire and cultivate diverse teams from all backgrounds, experiences, and perspectives. We believe that true innovation happens when everyone has room at the table and the tools, resources, and opportunity to excel.","{'projects': 0.00953204139918772, 'excel': 0.005733372510074395, 'work': 0.005108099297168486, 'oversees': 0.004651994500402317, 'establish': 0.004651994500402317, 'value': 0.004651994500402317, 'increase': 0.004651994500402317, 'sidebyside': 0.004651994500402317, 'external': 0.004651994500402317, 'reality': 0.004651994500402317, 'best': 0.004651994500402317, 'seekers': 0.004651994500402317, 'operators': 0.004651994500402317, 'combine': 0.004651994500402317, 'context': 0.004651994500402317, 'take': 0.004651994500402317, 'area': 0.004651994500402317, 'customized': 0.004651994500402317, 'think': 0.004651994500402317, 'takeout': 0.004651994500402317, 'enormous': 0.004651994500402317, 'annual': 0.004651994500402317, 'spend': 0.004651994500402317, 'investing': 0.004651994500402317, 'produce': 0.004651994500402317, 'high': 0.004651994500402317, 'margin': 0.004651994500402317, 'consumers': 0.004651994500402317, 'rewarding': 0.004651994500402317, 'dining': 0.004651994500402317, 'report': 0.004651994500402317, 'manager': 0.004651994500402317, 'incubate': 0.004651994500402317, 'pickuptakeoutinstore': 0.004651994500402317, 'typical': 0.004651994500402317, 'may': 0.004651994500402317, 'develop': 0.004651994500402317, 'attract': 0.004651994500402317, 'top': 0.004651994500402317, 'ideas': 0.004651994500402317, 'rollouts': 0.004651994500402317, 'sure': 0.004651994500402317, 'never': 0.004651994500402317, 'stop': 0.004651994500402317, 'strategize': 0.004651994500402317, 'unique': 0.004651994500402317, 'pickup': 0.004651994500402317, 'marketplace': 0.004651994500402317, 'engage': 0.004651994500402317, 'onboard': 0.004651994500402317, 'relationships': 0.004651994500402317, 'launch': 0.004651994500402317, 'scalable': 0.004651994500402317, 'experiment': 0.004651994500402317, 'use': 0.004651994500402317, 'tests': 0.004651994500402317, 'everything': 0.004651994500402317, 'selection': 0.004651994500402317, 'platform': 0.004651994500402317, 'analyze': 0.004651994500402317, 'models': 0.004651994500402317, 'evaluate': 0.004651994500402317, 'economic': 0.004651994500402317, 'costs': 0.004651994500402317, 'multiple': 0.004651994500402317, 'influence': 0.004651994500402317, 'development': 0.004651994500402317, 'account': 0.004651994500402317, 'engineering': 0.004651994500402317, 'merchant': 0.004651994500402317, 'marketing': 0.004651994500402317, 'guide': 0.004651994500402317, 'harness': 0.004651994500402317, 'opportunities': 0.004651994500402317, 'gotomarket': 0.004651994500402317, 'playbooks': 0.004651994500402317, 'experimenting': 0.004651994500402317, 'tactics': 0.004651994500402317, 'promote': 0.004651994500402317, 'adoption': 0.004651994500402317, 'years': 0.004651994500402317, 'managing': 0.004651994500402317, 'relevant': 0.004651994500402317, 'industries': 0.004651994500402317, 'plus': 0.004651994500402317, 'highgrowth': 0.004651994500402317, 'startup': 0.004651994500402317, 'like': 0.004651994500402317, 'presented': 0.004651994500402317, 'coming': 0.004651994500402317, 'creative': 0.004651994500402317, 'equally': 0.004651994500402317, 'operating': 0.004651994500402317, 'feet': 0.004651994500402317, 'foot': 0.004651994500402317, 'dont': 0.004651994500402317, 'hesitate': 0.004651994500402317, 'get': 0.004651994500402317, 'weeds': 0.004651994500402317, 'operate': 0.004651994500402317}"
cdfee6732aab5163,4139881f8014ab72,a813bfd03c48e3a3,df790c2238fd51e5,2,Faire,Faire,Faire,/q-Faire-l-san-francisco-jobs.html,San Francisco,US,,San Francisco,Strategy Associate,6cf5e6d389fd6d6b,0HcsNzDq-OLJ6bT4SC-8zC7vUnv1SLO-r2rZM0f0a6n678OlVnYggBjEwqkNXP0Z,"About Faire



Faire is an online wholesale marketplace built on the belief that the future of retail is local. There are over 1M independent retailers in the U.S. and Canada doing more than twice the revenue of Walmart and Amazon combined. At Faire, we're using the power of technology and data to connect a growing community of over 150,000 brands and independent retailers around the world. Picture your favorite boutique in town â€” we help them discover the best products to sell in their stores. By empowering entrepreneurs with the right tools and insights, we believe that we can level the playing field so that small businesses can compete with big box and e-commerce giants. We're looking for smart, resourceful and passionate people to join us as we power the shop local movement. If you believe in community, come join ours.



About this role



This is an opportunity to be one of the first members of Faire's core strategy team. You will help answer Faire's most important and ambiguous strategic questions, including assessing major new product extensions, new categories, international expansion, and the evolution of Faire's business and monetization model.



What you'll do




Break down complex and ambiguous questions with a mix of analytical rigor, customer insight, and input from internal and external experts


Work closely with the product, analytics, marketing, finance, and ops teams to translate recommendations into execution


Present your recommendations and debate their implications with Faire's executive team


Build the central nervous system at Faire and ensure that insights are accessible to all teams




Qualifications




Strong analytical problem solving skills and ability to identify and synthesize insights from data


Strong communication skills, including the ability to use verbal and written communication to express ideas clearly and succinctly


Excellent at breaking down unstructured problems and synthesizing many disparate sources of information to deliver simple and thoughtful answers


Strong business judgement, with ability to think across every dimension of the business


Experience with quantitative and qualitative consumer and market research techniques


Ability to operate with a high degree of autonomy and ownership


Curiosity, low ego, and willingness to learn from a wide range of people


A Bachelor's degree and 3+ years of experience across consulting, finance, business operations, product, strategy, or analytics roles




Why you'll love working at Faire




We are entrepreneurs: 
Faire is being built for entrepreneurs, by entrepreneurs. We believe entrepreneurship is a calling and our mission is to empower entrepreneurs to chase their dreams. Every member of our team is an owner of the business and taking part in the founding process.


We are using technology and data to level the playing field:
 We are leveraging the power of product innovation and machine learning to connect brands and boutiques from all over the world, building a growing community of over 100,000 small business owners.


We build products our customers love:
 Everything we do is ultimately in the service of helping our customers grow their business because our goal is to grow the pie - not steal a piece from it. Running a small business is hard work, but using Faire makes it easy.


We are curious and resourceful:
 Inquisitive by default, we explore every possibility, test every assumption, and develop creative solutions to the challenges at hand. We lead with curiosity and data in our decision making, and reason from a first principles mentality.




Faire was founded in 2017 by a team of early product and engineering leads from Square. We're backed by some of the top investors in retail and tech including: Y Combinator, Lightspeed Venture Partners, Forerunner Ventures, Khosla Ventures, Sequoia Capital, Founders Fund, and DST Global. We have headquarters in San Francisco and Kitchener-Waterloo, and a global employee presence across offices in Salt Lake City, Atlanta, Toronto, London and Sao Paulo. To learn more about Faire and our customers, you can read more on our blog.



Faire provides equal employment opportunities (EEO) to all employees and applicants for employment without regard to race, color, religion, sex, national origin, age, disability, genetics, sexual orientation, gender identity or gender expression.","{'join': 0.005104036204306663, 'online': 0.004627309061913647, 'wholesale': 0.004627309061913647, 'marketplace': 0.004627309061913647, 'belief': 0.004627309061913647, 'future': 0.004627309061913647, 'canada': 0.004627309061913647, 'twice': 0.004627309061913647, 'revenue': 0.004627309061913647, 'walmart': 0.004627309061913647, 'amazon': 0.004627309061913647, 'combined': 0.004627309061913647, 'around': 0.004627309061913647, 'picture': 0.004627309061913647, 'favorite': 0.004627309061913647, 'boutique': 0.004627309061913647, 'town': 0.004627309061913647, 'discover': 0.004627309061913647, 'best': 0.004627309061913647, 'sell': 0.004627309061913647, 'stores': 0.004627309061913647, 'empowering': 0.004627309061913647, 'right': 0.004627309061913647, 'tools': 0.004627309061913647, 'businesses': 0.004627309061913647, 'compete': 0.004627309061913647, 'big': 0.004627309061913647, 'box': 0.004627309061913647, 'ecommerce': 0.004627309061913647, 'giants': 0.004627309061913647, 'looking': 0.004627309061913647, 'smart': 0.004627309061913647, 'passionate': 0.004627309061913647, 'shop': 0.004627309061913647, 'movement': 0.004627309061913647, 'come': 0.004627309061913647, 'role': 0.004627309061913647, 'opportunity': 0.004627309061913647, 'one': 0.004627309061913647, 'members': 0.004627309061913647, 'core': 0.004627309061913647, 'answer': 0.004627309061913647, 'important': 0.004627309061913647, 'strategic': 0.004627309061913647, 'assessing': 0.004627309061913647, 'major': 0.004627309061913647, 'extensions': 0.004627309061913647, 'categories': 0.004627309061913647, 'international': 0.004627309061913647, 'expansion': 0.004627309061913647, 'evolution': 0.004627309061913647, 'monetization': 0.004627309061913647, 'model': 0.004627309061913647, 'break': 0.004627309061913647, 'complex': 0.004627309061913647, 'mix': 0.004627309061913647, 'rigor': 0.004627309061913647, 'customer': 0.004627309061913647, 'insight': 0.004627309061913647, 'input': 0.004627309061913647, 'internal': 0.004627309061913647, 'external': 0.004627309061913647, 'experts': 0.004627309061913647, 'closely': 0.004627309061913647, 'marketing': 0.004627309061913647, 'ops': 0.004627309061913647, 'translate': 0.004627309061913647, 'execution': 0.004627309061913647, 'present': 0.004627309061913647, 'debate': 0.004627309061913647, 'implications': 0.004627309061913647, 'executive': 0.004627309061913647, 'central': 0.004627309061913647, 'nervous': 0.004627309061913647, 'system': 0.004627309061913647, 'ensure': 0.004627309061913647, 'accessible': 0.004627309061913647, 'qualifications': 0.004627309061913647, 'problem': 0.004627309061913647, 'solving': 0.004627309061913647, 'identify': 0.004627309061913647, 'synthesize': 0.004627309061913647, 'use': 0.004627309061913647, 'verbal': 0.004627309061913647, 'written': 0.004627309061913647, 'express': 0.004627309061913647, 'ideas': 0.004627309061913647, 'clearly': 0.004627309061913647, 'succinctly': 0.004627309061913647, 'excellent': 0.004627309061913647, 'breaking': 0.004627309061913647, 'unstructured': 0.004627309061913647, 'problems': 0.004627309061913647, 'synthesizing': 0.004627309061913647, 'many': 0.004627309061913647, 'disparate': 0.004627309061913647, 'sources': 0.004627309061913647, 'information': 0.004627309061913647, 'deliver': 0.004627309061913647, 'simple': 0.004627309061913647}"
