jk,efccid,srcid,cmpid,num,srcname,cmp,cmpesc,cmplnk,loc,country,zip,city,title,locid,rd,description,keywords
24570c3765f6d092,e5516e1ddd31dc3a,3363f4493e6cd75a,70fe18ed48043904,0,Chowbotics,Chowbotics,Chowbotics,/q-Chowbotics-l-san-francisco-jobs.html,San Francisco,US,,San Francisco,Senior Associate,6cf5e6d389fd6d6b,FUEnljPEf7Zt_MLAHMawTo2OEkOwSw4DnIXJFT6lUD3DY08KVZ4tJetedSGIUR4P,"About the Team



On the Chowbotics Strategy & Operations team, our mission is to have best-in class restaurant selection, build new services for our merchants to grow their business, and help our partners on the platform. The Chowbotics Strategy & Operations organization determines the go-to-market strategy for our fresh food robots, guides our Partners who purchase a robot through a seamless onboarding experience and ensures that they continue to be setup for success once they have begun their partnership on the platform. We also work with our Consumers that purchase bowls from our robot, to ensure satisfaction.



About the Role



As a Senior Associate, Strategy and Operations supporting Chowbotics, reporting to our Senior Manager, Strategy & Operations, you will help support DoorDash's growth in every market in which we operate. You will oversee the success of a vertical, building new internal processes, leading strategic projects, and working side-by-side with our Product team to build new product features. You will be a part of a unique opportunity to support our go-to-market strategies for our fresh food robot.



As the team grows, we are looking to help the company scale and improve the quality of our Partners' experience. You will work on project that include running pilots with our Merchant partners, building dashboards for the team, defining metrics to move the business forward, holding the team accountable to achieve our goals, and finding new ways to improve internal processes.



You're excited about this opportunity because you will…


Strategize
 – Understand the needs of merchants, prioritize them by impact on the business, and co-create solutions with Account Managers.

Implement
 – Guide new DoorDash merchant projects and provide feedback to our product team to improve the way we do things

Analyze
 – Build the analytics infrastructure, metrics and tools to help retain and grow our most important merchants

Influence
 – Work with our Product, Operations, and Sales teams to make sure merchants have the best possible experience when using DoorDash's services


We're excited about you because…


You have 2+ years of experience in consulting / strategy / business development / operations / technology / banking / analytics or related experience

You have experience leading projects, working across different teams, and thrive in a team environment

You have Excel (can maintain complex spreadsheets) mastery and SQL proficiency

You can provide applicable recommendations out of complex datasets

You have experience in a customer-facing or relationship management role

You have experience with data visualization tools (ex. Tableau, Data Studio, Mode, etc)


Why You'll Love Working at DoorDash



We are leaders
 – Leadership is not limited to our management team. It's something everyone at DoorDash embraces and embodies.



We are operators
 – We believe the only way to predict the future is to build it. Creating solutions to lead our company and our industry is what we do on every project, every day.



We are learners
 – Everyone here is continually learning on the job, no matter if we've been in a role for one year or one minute. We are committed to learning and implementing what is best for our customers, merchants, and dashers.



We are one team 
– The magic of DoorDash is our people, together making our inspiring goals attainable and driving us to greater heights.



About DoorDash



At DoorDash, our mission to empower local economies shapes how our team members move quickly and always learn and reiterate to support merchants, Dashers and the communities we serve. We are a technology and logistics company that started with door-to-door delivery, and we are looking for team members who can help us go from a company that is known for delivering food to a company that people turn to for any and all goods.



DoorDash is growing rapidly and changing constantly, which gives our team members the opportunity to share their unique perspectives, solve new challenges, and own their careers. Our leaders seek the truth and welcome big, hairy, audacious questions. We are grounded in our company values, and we make intentional decisions that are both logical and display empathy for our range of users—from Dashers to Merchants to Customers.



We're committed to supporting employees' happiness, healthiness, and overall well-being by providing comprehensive benefits and perks including premium healthcare, wellness expense reimbursement, paid parental leave and more.



Our Commitment to Diversity and Inclusion



We're committed to growing and empowering a more inclusive community within our company, industry, and cities. That's why we hire and cultivate diverse teams of people from all backgrounds, experiences, and perspectives. We believe that true innovation happens when everyone has room at the table and the tools, resources, and opportunity to excel.



Statement of Non-Discrimination: In keeping with our beliefs and goals, no employee or applicant will face discrimination or harassment based on: race, color, ancestry, national origin, religion, age, gender, marital/domestic partner status, sexual orientation, gender identity or expression, disability status, or veteran status. Above and beyond discrimination and harassment based on ""protected categories,"" we also strive to prevent other subtler forms of inappropriate behavior (i.e., stereotyping) from ever gaining a foothold in our office. Whether blatant or hidden, barriers to success have no place at DoorDash. We value a diverse workforce – people who identify as women, non-binary or gender non-conforming, LGBTQIA+, American Indian or Native Alaskan, Black or African American, Hispanic or Latinx, Native Hawaiian or Other Pacific Islander, differently-abled, caretakers and parents, and veterans are strongly encouraged to apply. Thank you to the Level Playing Field Institute for this statement of non-discrimination.



If you need any accommodations, please inform your recruiting contact upon initial connection.","{'experience': 0.01122576394215493, 'projects': 0.006900801576371136, 'project': 0.0046005343842474246, 'unique': 0.004106853960985899, 'bestin': 0.0038337786535395206, 'class': 0.0038337786535395206, 'restaurant': 0.0038337786535395206, 'selection': 0.0038337786535395206, 'organization': 0.0038337786535395206, 'determines': 0.0038337786535395206, 'robots': 0.0038337786535395206, 'guides': 0.0038337786535395206, 'seamless': 0.0038337786535395206, 'onboarding': 0.0038337786535395206, 'ensures': 0.0038337786535395206, 'continue': 0.0038337786535395206, 'setup': 0.0038337786535395206, 'begun': 0.0038337786535395206, 'partnership': 0.0038337786535395206, 'consumers': 0.0038337786535395206, 'bowls': 0.0038337786535395206, 'ensure': 0.0038337786535395206, 'satisfaction': 0.0038337786535395206, 'associate': 0.0038337786535395206, 'reporting': 0.0038337786535395206, 'manager': 0.0038337786535395206, 'growth': 0.0038337786535395206, 'market': 0.0038337786535395206, 'operate': 0.0038337786535395206, 'oversee': 0.0038337786535395206, 'vertical': 0.0038337786535395206, 'strategic': 0.0038337786535395206, 'sidebyside': 0.0038337786535395206, 'features': 0.0038337786535395206, 'part': 0.0038337786535395206, 'strategies': 0.0038337786535395206, 'grows': 0.0038337786535395206, 'scale': 0.0038337786535395206, 'quality': 0.0038337786535395206, 'include': 0.0038337786535395206, 'running': 0.0038337786535395206, 'pilots': 0.0038337786535395206, 'dashboards': 0.0038337786535395206, 'defining': 0.0038337786535395206, 'forward': 0.0038337786535395206, 'holding': 0.0038337786535395206, 'accountable': 0.0038337786535395206, 'achieve': 0.0038337786535395206, 'finding': 0.0038337786535395206, 'ways': 0.0038337786535395206, 'youre': 0.0038337786535395206, 'strategize': 0.0038337786535395206, 'understand': 0.0038337786535395206, 'needs': 0.0038337786535395206, 'prioritize': 0.0038337786535395206, 'impact': 0.0038337786535395206, 'cocreate': 0.0038337786535395206, 'account': 0.0038337786535395206, 'managers': 0.0038337786535395206, 'implement': 0.0038337786535395206, 'guide': 0.0038337786535395206, 'feedback': 0.0038337786535395206, 'things': 0.0038337786535395206, 'analyze': 0.0038337786535395206, 'infrastructure': 0.0038337786535395206, 'retain': 0.0038337786535395206, 'important': 0.0038337786535395206, 'influence': 0.0038337786535395206, 'sales': 0.0038337786535395206, 'sure': 0.0038337786535395206, 'possible': 0.0038337786535395206, 'using': 0.0038337786535395206, 'years': 0.0038337786535395206, 'consulting': 0.0038337786535395206, 'development': 0.0038337786535395206, 'banking': 0.0038337786535395206, 'related': 0.0038337786535395206, 'across': 0.0038337786535395206, 'different': 0.0038337786535395206, 'thrive': 0.0038337786535395206, 'environment': 0.0038337786535395206, 'maintain': 0.0038337786535395206, 'spreadsheets': 0.0038337786535395206, 'mastery': 0.0038337786535395206, 'sql': 0.0038337786535395206, 'proficiency': 0.0038337786535395206, 'applicable': 0.0038337786535395206, 'recommendations': 0.0038337786535395206, 'datasets': 0.0038337786535395206, 'customerfacing': 0.0038337786535395206, 'relationship': 0.0038337786535395206, 'visualization': 0.0038337786535395206, 'ex': 0.0038337786535395206, 'tableau': 0.0038337786535395206, 'studio': 0.0038337786535395206, 'mode': 0.0038337786535395206, 'etc': 0.0038337786535395206, 'youll': 0.0038337786535395206, 'love': 0.0038337786535395206, 'leadership': 0.0038337786535395206}"
175e6e44a8c26f39,14683000b7204958,71a7ae1bea89ccaf,a246b5c11ee7c115,1,Indeed,Kyte Systems Inc.,Kyte Systems Inc.,/q-Kyte-Systems-l-san-francisco-jobs.html,San Francisco,US,,San Francisco,Strategic Finance Associate,6cf5e6d389fd6d6b,X2RuiEv55klVlnSbj5Pcj6AgjXds5G-xKOl5Al5HAI5X_780q-FTp_xmgQY0N9II,"Kyte is a technology platform that brings seamless delivery into the rental car experience. We are building the most compelling way to rent a car by committing to relentless customer centricity, technology-powered operational excellence, and capital efficiency. With our vision of 
giving people better access to fewer cars
, we saw record growth throughout COVID19, and are now doubling down on gaining market share with our recent raise of more than $9M in venture funding from some of the best investors in the industry (amongst others: investors in Auto 1, Bird, Lime, DoorDash, Flexport, and Slack).
At Kyte, we love what we do and we believe our diverse team of ridiculously ambitious individuals is what makes our company great. Together, we are mobility enthusiasts that have an assortment of wide-ranging backgrounds from Stanford, Berkeley, MIT, TUM, Uber, BMW, McKinsey, and others. We are headquartered in the sunny, San Francisco Marina district where we enjoy Bay views, good food, and a proper sound system for those late night working sessions. We have opened our second home strategically close to Oktoberfest in Munich, just 5 min from the Central Station in the beautiful district of Nymphenburg.
We offer competitive compensation, significant equity, and the ability to shape a big vision from early on. We are laser focused on bringing on talented individuals that are aligned with our vision and mission, to create a magical rental car experience from end to end. You will have more than significant ownership and impact on our company trajectory, and shape how people get around the cities they live in. We look forward to hearing from you!
About the role
We are excited to grow our finance team at Kyte and looking to bring on new team members. We’re seeking highly motivated people with strong financial and start-up backgrounds that want to disrupt the way people travel. The role is highly cross-functional, involving coordination across a number of groups within Kyte, including finance, supply, product, and operations. In other words, you will sit in the “control tower” and get exposure to all parts of the business. Successful candidates will have a passion for transportation/travel, superior financial accounting and analytical skills, bias toward action, exceptional organizational and communication skills. We move quickly as a team to drive company wide decisions, thus a balance getting the details right while still moving fast is important. Finally, we want someone who wants to learn & grow: you will get as much out of this as you want and will grow in the process.
General requirements: 
You like to take ownership when solving problems: 
 We believe in extreme ownership and look for people who will make decisions as if it were their own company
Relevant Experience: 
 Experience working in a fast growing technology company or Investment Banking, Consulting/ Business Operations / Corporate finance functions
Own Financial Models: 
 Develop financial models to forecast revenue, costs and KPIs across business units. Create unit economics frameworks to evaluate the performance of various products, features and markets to inform future business decisions. Develop models to gauge TAM and profitability for new market and product launches.
Strategic Initiatives: 
 Develop data-driven materials and other external reporting to advise investors and other key stakeholders on overall performance. Suggest new financial and operational business metrics to further improve performance
Technical Expertise: 
 Expertise in spreadsheet financial models and analytical skills. Familiarity with SQL and data visualization is a plus.
Problem solving: 
 Are you the kind of person who sees a problem and asks “why”? We are first and foremost a technology company, so you we want a data-driven mindset, strong business judgment, and proven ability to perform analysis, draw key insights, and form and execute a strategy
Ambition: 
Do you want to be a leader in an organization? You will be involved in the highest level leadership discussions and quickly become a leader - guaranteed.
Passion for Kyte
, its role improving our access to transportation, and an interest in the platform methodology.
Desire to learn: 
This is a two way street, we want you to learn and grow in the role and our team is here to support you along the journey.
Attributes that we look for, and that match the team you will be joining: 
Passion: You strive to love what you do and are highly self-motivated to achieve your goals.
Ambition: You are ridiculously ambitious and want to get the most out of your life.
Curiosity: You’re the kind of person who wants to know how everything works. You love to learn new things every day.
Hustle: You go above and beyond and put the pedal to the metal to get things done with your results-driven attitude.
Data: You like to work analytically and make data-informed decisions.
Social: You have the ability to build relationships quickly with your outgoing and confident personality.
Creative: You are creative in finding solutions for your challenges.
Humility: You know that you’re part of a community that’s building something awesome and are willing to seek help or guidance when necessary.
Organization: You’re not easily overwhelmed because you have the organizational skills to juggle multiple tasks.
Desired (but not required)
Advanced degree in Finance/MBA/CFA preferred
Experience in working for a startup
Previously worked for a top tier consultancy, Investment Bank, PE/VC
Desire to learn about the travel or mobility industry
What we can offer you
Opportunity to be part of an early-stage Silicon-Valley based startup with massive growth and venture potential
Ability to own major parts of an operation that potentially touches millions of users
An incredible team supporting you
Medical + Dental Health Insurance
$200 Commuter Benefit
$50 Gym Membership Reimbursement
Calm App Yearly Subscription
Job Type: Full-time
Work Remotely:
Yes","{'experience': 0.006955733735536454, 'quickly': 0.006132930985622461, 'organizational': 0.005582472339322902, 'organization': 0.005582472339322902, 'brings': 0.003975085618657259, 'seamless': 0.003975085618657259, 'delivery': 0.003975085618657259, 'compelling': 0.003975085618657259, 'rent': 0.003975085618657259, 'committing': 0.003975085618657259, 'relentless': 0.003975085618657259, 'customer': 0.003975085618657259, 'centricity': 0.003975085618657259, 'technologypowered': 0.003975085618657259, 'excellence': 0.003975085618657259, 'capital': 0.003975085618657259, 'efficiency': 0.003975085618657259, 'giving': 0.003975085618657259, 'better': 0.003975085618657259, 'fewer': 0.003975085618657259, 'cars': 0.003975085618657259, 'saw': 0.003975085618657259, 'record': 0.003975085618657259, 'throughout': 0.003975085618657259, 'doubling': 0.003975085618657259, 'gaining': 0.003975085618657259, 'share': 0.003975085618657259, 'recent': 0.003975085618657259, 'raise': 0.003975085618657259, 'funding': 0.003975085618657259, 'best': 0.003975085618657259, 'amongst': 0.003975085618657259, 'auto': 0.003975085618657259, 'bird': 0.003975085618657259, 'lime': 0.003975085618657259, 'doordash': 0.003975085618657259, 'flexport': 0.003975085618657259, 'slack': 0.003975085618657259, 'diverse': 0.003975085618657259, 'makes': 0.003975085618657259, 'great': 0.003975085618657259, 'together': 0.003975085618657259, 'enthusiasts': 0.003975085618657259, 'assortment': 0.003975085618657259, 'wideranging': 0.003975085618657259, 'stanford': 0.003975085618657259, 'berkeley': 0.003975085618657259, 'mit': 0.003975085618657259, 'tum': 0.003975085618657259, 'uber': 0.003975085618657259, 'bmw': 0.003975085618657259, 'mckinsey': 0.003975085618657259, 'headquartered': 0.003975085618657259, 'sunny': 0.003975085618657259, 'san': 0.003975085618657259, 'francisco': 0.003975085618657259, 'marina': 0.003975085618657259, 'enjoy': 0.003975085618657259, 'bay': 0.003975085618657259, 'views': 0.003975085618657259, 'good': 0.003975085618657259, 'food': 0.003975085618657259, 'proper': 0.003975085618657259, 'sound': 0.003975085618657259, 'system': 0.003975085618657259, 'late': 0.003975085618657259, 'night': 0.003975085618657259, 'sessions': 0.003975085618657259, 'opened': 0.003975085618657259, 'second': 0.003975085618657259, 'home': 0.003975085618657259, 'strategically': 0.003975085618657259, 'close': 0.003975085618657259, 'oktoberfest': 0.003975085618657259, 'munich': 0.003975085618657259, 'min': 0.003975085618657259, 'central': 0.003975085618657259, 'station': 0.003975085618657259, 'beautiful': 0.003975085618657259, 'nymphenburg': 0.003975085618657259, 'competitive': 0.003975085618657259, 'compensation': 0.003975085618657259, 'equity': 0.003975085618657259, 'big': 0.003975085618657259, 'early': 0.003975085618657259, 'laser': 0.003975085618657259, 'focused': 0.003975085618657259, 'bringing': 0.003975085618657259, 'talented': 0.003975085618657259, 'aligned': 0.003975085618657259, 'mission': 0.003975085618657259, 'magical': 0.003975085618657259, 'impact': 0.003975085618657259, 'trajectory': 0.003975085618657259, 'around': 0.003975085618657259, 'cities': 0.003975085618657259, 'live': 0.003975085618657259, 'forward': 0.003975085618657259, 'hearing': 0.003975085618657259, 'excited': 0.003975085618657259}"
